,number,steam_id,playtime_at_review,voted_up,votes_up,review,story,graphic,character,music,Operability,story_state
263,263,76561198272246522,248,False,5,"８～９割がた青春シミュレーター

部活・バイト・恋愛etcを通して人との絆を深めることで戦う力を高めていく
意味不明ですって？そういう設定なんです
なぜ、何と戦うの？
気にしないでください、そういう設定です

ざっくりいえば世のRPGがレベルを上げたり装備を整えたりする代わりに青春を謳歌するゲームです
RPGとは？？なんでRPGなのこれ・・いっそADVにしたら？",,,,,,0
264,264,76561199208062336,3047,True,0,　,,,,,,0
265,265,76561198868845987,20086,True,6,"昔のゲームですが、初。とてもよかった。英語音声つきなのもありがたい。
確かに古臭さは否めないものの、システムも話の展開も悪くないと思った。
女神転生は昔からやってましたが、ペルソナはある時からやらなくなりましたが、
こういうシステムだったのね。いいゲームだし、コスパもいい。
アトラスさんは本当にいい仕事をします。",,,,,,0
266,266,76561199066091932,197,True,0,面白い,,,,,,0
267,267,76561198185388425,7667,True,18,"100時間近くプレイして爽やかで心地よい気分でエンディングを迎えました（ただし、一部達成できてない部分もあります）。
ペルソナという能力への考察、それを活かしたストーリー展開、緩急のあるどちらかというと明るい要素の多いイベント、魅力的な仲間と臨場感ある演出などで没頭して楽しむことができました。前から聞いていた通りＵＩなどデザインがおしゃれだなーとも思いました。

時間の大部分はダンジョン探索だったと思います。
最初はSP(MPみたいなもの)が減ってすぐに家に戻ったりしていたんですが、途中からは仲間のアシストやスキルによって戦闘後自動回復が効いて、かなりペルソナの技を使ってもMPが半分以下になることも少なく、ついダンジョン探索でレベル上げやアイテム収集に没頭していました。

ダンジョンと街両方でいえることですが、BGMがかっこよかったり心地よかったりちょっとおしゃれな感じなのも続けやすかった理由だと思います。歌詞が入っていて一見何度も聞くサウンドとしてはどうなんだろうと思うかもしれませんが、耳障りではなくそれでいて耳にのこるとてもよい音楽でした。

PSPがもとということでスリープ前提だったと思うのですが、10Fもあって下手したら1時間程度1つのダンジョンにかかるのですが、中断機能がないのがsteam版としてはちょっとつらかったです。トラエスト(リレミト)とか脱出用のアイテムも買ったり宝箱から取得できるので、それで一度戻って、また途中のフロアから始めるということはできます。

画像はポリゴンはちょっとあらいですが、たまに入るアニメーションはとてもきれいです。
あと声優さんたちのおかげでキャラがとても際立っていて、ちょっとしたダンジョン移動やバトルでの呼びかけや街や学校でのトークも臨場感を感じられました。
操作性も特に悪くはないです。

不満点は意外とスケジュール管理？が難しいという点です。
みんなとの絆を深めていくために会ってイベントを行うのですが、計画的にやらないと慣れてない人にコンプリートは難しいと思いました。
2周目は以前のデータの一部が引き継げるのでそれから始めれば、もっと効率的にできると思います。ただ、引継ぎ要素はもうちょっと増やして欲しかったです。例えばある条件を満たして運が良ければ現れる敵を倒すと得られる強い武器などの装備品が残らないのはちょっと面倒だなと思いました。

あと、いきなり数日とんでしまったり、自分が考えていたよりも早く季節が過ぎていくことが数回あり、ちょっとそこは理不尽さを感じました。

イベントを進めたりするために必要な知識とか寛容さなどのパラメータをバイトや本やイベントであげていく育成要素もあって楽しいのですが、その値がはっきりわからないので後どの程度やれば必要なランクまであがるのかわかりにくいのが不便でした。

他にはwikiを見ればわかるのであまり問題ないですが、その日に誰とイベントが行えるのかは全エリアチェックしなくてもすむように何かリストでも出してもらえるとよかったなと思いました。

私はペルソナ初心者なので、悪魔の作り方や、悪魔の管理の仕方（自分で所持できる数が決まっているけど、本に登録しておけばお金を払っていつでも呼び出せる）も最初わかりにくかったです。

不満点も書きましたが、総じてとても良いゲーム体験でした。

二転三転するSFじみた事件のミステリアスさ、仲間たちとのコミカルさや青春ぽさ、それぞれのキャラの個性に応じた悩みや成長の仕方がとても心地よく伝わってくるよいストーリーとセリフでした。

あとは時間を使ったダンジョン探索ですが、とくにハクスラのような武器堀りはありませんが、街の人の依頼でアイテムを探し回ったり、多くのペルソナを手に入れるために何度も入る単純作業がわりと楽しかったです。

100時間もやったので、コミュニティコンプリートを目指した二周目をすぐに始める気にはなりませんが、お気に入りの小説や映画のようにふとしたときにまたやりたくなる後味のよい作品でした。",,,,,,1
268,268,76561198343176285,1926,True,2,"ペルソナ5などを見たあとだと、あーそういえばこんなグラフィックだったなーと懐かしくなってしまうゲーム
引っかかるところはグラフィックぐらいしかない間違いない名作です

",,,,,,0
269,269,76561198796092763,237,True,1,"まだ、序盤の部分しかプレイできていませんが、自分のパソコンに合わせれ画質を設定しました！
画質が良すぎて感動しちゃいました！！
これからプレイしていく予定で、とても楽しみです！",,,,,,0
270,270,76561198336865597,5882,True,0,"VIta時代のゲームだからか、要求スペックがかなり低い。
画質を下げれば数年前のノートPCでも普通に動く。

日常生活でコミュを築き、ペルソナ育成に活かしていく。
その日常生活というものが、百貨店だけあるような片田舎が舞台でありながら、あまりにも濃密すぎる。
発売後数年に渡りアトラスという会社を支え続けた男の原点を垣間見られる。
続けていく内に、こんな学生生活を送ってみたかったとなること間違いなし。

ペルソナの育成も、ペルソナのステータスを上昇させ続けられる可能性のあるシャッフルタイム、そして様々なスキルを覚えさせられるスキルカードというシステムにより、気に入ったペルソナを使い続けられることも可能。

終わることが惜しいと感じたゲームに、久々に会いました。",,,,,,0
271,271,76561198044908836,10264,True,8,"ペルソナシリーズ初プレイ　面白すぎる神ゲー！！　こんな学生生活したかった

ペルソナ５も出してほしい！！お願いします！！",,,,,,0
272,272,76561198052733667,6254,True,8,"メガテンシリーズはやってきたがペルソナシリーズは初プレイ。
両者とも人間の本質を見極めながら新しい世界を見出すという点では共通しているが、
最近のメガテンが絶望を選ぶ話ならP4Gは希望をつかみとる話、全くの対照的で驚いた。
メガテンも昔はそういう流れだったはずだけど３以降のせいで固定観念が植え付けられてしまったのかもしれない。
ノーマルを悪魔事典を現時点限界の94%埋めたところでtrueEND2クリア。クリア時間は90時間ぐらい。普通にやれば60時間ぐらい？

ゲームは戦闘のないアドベンチャーパートと戦闘のあるダンジョンパートに分かれている。
アドベンチャーパートでは一日ごとに進み、高校生活を過ごしていく中で事件が発生する。
事件ごとに登場するダンジョンパートでボスを倒して次の事件へという流れ。
ダンジョンをクリアすればいつでも行くことができるようになるが、ダンジョンボスを倒してしまえばストーリー上は行く必要がなくなる。
ラストダンジョンで相当金稼ぎしまくってアドベンチャーパート6割、ダンジョンパート4割ぐらいなので普通にやればアドベンチャーパート7割ダンジョンパート3割ぐらいではないかと思う。
これは好みの分かれるところだと思う。

戦闘はオーソドックスなターン制RPG。
敵には弱点属性が用意されており、弱点属性をつけばスタンを取ることができる。
全ての敵をスタンさせることができれば総攻撃を仕掛けて大ダメージを与えることができる。
攻撃属性に対して得意な敵だった場合には最悪死に至る反撃を食らうこともある。
反撃を食らわないように全スタンを狙っていこうとするとパズル的な面白さが出てくる。
属性を無視する万能属性魔法が便利すぎたり、即死効果のある属性のデメリットが少なすぎたり、一度ターンを飛ばせば2倍以上のダメージを与える攻撃ができるスキルがあるので、ただ敵を倒すということに対しては難しいものではない。
この辺りを極力縛った方がゲームとしては楽しい気がする。

エンディングを迎えたくないと思ってしまうゲームは久々。
本作のおかげで過去作、P5に手を出してみたくなった。
神ゲーと称されただけあってJ-RPG史上に名を遺すタイトルであることには間違いない。",,,,,,0
273,273,76561198287865365,8448,True,0,最強,,,,,,0
274,274,76561198975961378,3563,True,2,"日常パートとRPGのダンジョンパートが分かれている。
日常パートが楽しかったが、ダンジョンは途中から面倒に感じた。",,,,,,0
275,275,76561199024283350,7044,True,1,"神ゲー。
一つだけ不満点を挙げるとしたらゲームを起動すると休日が潰れることかな。",,,,,,0
276,276,76561198873258098,3069,True,1,"※４周目で全実績取得したので、これを期にアップデート。

ただクリアするだけなら１周でいけるけど、実績取得を目指すなら複数周回が必要。自分は４周目で全実績取得できたけど、取得の流れは概ね次のような感じ。ちゃんとやれば２周で全部とれるような気がする。

１周目：ノーマルエンド。普通にやって取れる実績のみ取得。
２周目：トゥルーエンド。実績は若干の上積みのみ。
３周目：トゥルーエンド＋M戦勝利。実績取得を頑張り、残り３つとした。
４周目：トゥルーエンド＋M戦勝利。残っていた「ビブリオマニア」「りせファン」を取得し全実績取得。

最初は難易度をSAFETYまで下げて、それでもボス戦とかは苦戦していたけど、さすがに３～４周目ともなると難易度を上げてもさほど苦労しなくなった。（特に実績「りせファン」は難易度を下げてると非常にとりにくくなる）
いままで、JRPGで続けて何周もやりたくなるゲームってなかったけど、このゲームはエンディングを迎えてもついもう一度最初からやってしまうくらいの魅力があった。とても良いゲーム体験ができたと思う。おすすめ。



なお、以下は１周クリア時点でのレビュー。
ーーーーーーーーーーーーーーーーーーーーーーーー
難易度を下げて真エンディングでクリア済み、現在２周目。
これ、ベースの戦闘難易度は相当難しいんだろうなあ、と感じた。思いっきり難易度を下げて遊んだのに、通常戦闘もヌルゲーにはならなかったしボスキャラはじっくり個別指示を出さないと勝てなかったから。逆に言えば、難易度調整の幅が広くなっているおかげで、もともと難しいゲームなのに、誰でも遊べる懐の広さが生まれていると思う。

このゲームの一番の面白さは、物語とそれをとりまく雰囲気にある。
東京から１年限定で地方都市に引っ越してきた高校生の主人公が、新天地で仲間と出会い、困難に立ち向かい、励ましあって成長していく、そんなベタな「青春ストーリー」を、異世界のモンスターとの戦いのなかで描いていくジュブナイルJRPGになっていて、本当に魅力的で最後まで楽しめた。
舞台となっている地方都市も、見事に「日本の地方都市らしさ」を切り取っていて、妙なリアルさがある。それに加えて、推理ミステリー的な要素も入っていて、途中には「選択式の推理シーン」もあり、推理を誤るとバッドエンドに進んでしまう（直前でセーブできるのでやり直しはできる）など、趣向が凝らされている。
そして、登場人物もみな個性があって魅力的。あと、BGMがすごく良くて、これも雰囲気づくりに大きく寄与していると思う（別途サントラまで買ってしまったくらい）。

JRPGの魅力の大半はストーリーにあると思うので、そんな「ストーリーの魅力」だけでこのゲームは強くおすすめできると思う。
一方で、RPGとしてみると、特筆するものがそんなにないようにも感じた。
戦闘はオールドスクールなコマンド式で、物理攻撃、ペルソナによる魔法、アイテム使用などごく基本的なスタイル（コンボによる連続攻撃が強調されているところはユニークだといえるかも）。味方のターンの途中で敵の攻撃が割り込むこともないし、前後の戦闘位置のフォーメーションなどの概念もないシンプルなもの。自動生成マップでできているダンジョンもシンプルで、迷うということはまずない。主人公のペルソナは合成により成長させることができるが、仕組みが複雑で、攻略情報なしではほぼ行き当たりばったりにならざるを得ない。
また、戦闘のない普段の生活は「（これまたオールドスクールな）育成シミュレーション」の様相を呈しており、学校や町の中を動き回って、毎日の限られたコマンド数のなかで仲間と交流したりサブクエストをこなしたり読書やバイトをしたりして、「自分のステータス」と「仲間との友情レベル」などを適切に上昇させていくことが求められる。戦闘と「育成シミュレーション」の割合は１：１もしくは育成やってるほうが長いくらいなので、純粋なJRPGをやりたい人にはかなり面倒に感じられるんじゃないかと思う（自分もちょっと面倒だった。まあ、育成パートでストーリーが進むので仕方ない気もする）。

また、もとが古いゲームなので、「ゲイの人がオネエ言葉を使い、ヘテロ男性が気持ち悪がる」「水着になった女子の容姿について男子が論評し、それを女子が恥ずかしがる」みたいな、最近の価値観に照らすと性差別的に思える描写が割とちょくちょく出てきてモニョるところもある。もし将来再度のリメイクがあるなら、この辺りは直してくれるともっと物語に入っていけるように思う。

全体としてみると、古き良きJRPGを遊びたい人、JRPGをあまり遊んだことがなくて試してみたい人、クサい青春ストーリーみたいなのにたまにはひたってみたい人、あたりには自信をもってすすめられると思う。",,,,,,1
277,277,76561199087778341,6394,True,0,"以前からやってみたかったためか、気付いたら１００時間プレイしていました。とても充実しています。
ペルソナシリーズが好きな方、興味がある方にとてもおすすめします。お値段も手頃なので買って損はないでしょう。ただしゲームのプレイはまとめてすることが望ましいでしょう。長期休暇のゲームとしても有効に思います。",,,,,,0
278,278,76561198992661836,4735,True,0,,,,,,,0
279,279,76561198145647037,1381,True,0,"Nevermore, Nevermeme",,,,,,0
280,280,76561199058406819,4696,True,0,雪子しか勝たん,,,,,,0
281,281,76561199099638345,8661,True,0,花村陽介きゅんマジかわ！菜々子と結婚したい方におすすめ！！,,,,,,0
282,282,76561198990619562,8035,True,2,神ゲーof神ゲー,,,,,,0
283,283,76561199170827079,3228,True,1,"ゲーム内でどのような場面であってもフリーズが多発する。プレイ時間が長くなるダンジョン中ではしばしば起こるため、日常パートでのこまめにセーブが通用しない。もし難易度をノーマル以上にしているならば（探索中の間だけでも）スグにイージー以下に変更をお勧めする（ただしイージー以下にしたところでフリーズが減るということは全くないので気を付けること、あくまでストレスを極力減らすための抵抗である）強いて言えば7月後半のダンジョンからフリーズが増加する。
　この不具合を制作会社が直す気がないなら詐欺と言っても過言ではないかもしれない、価格の安さはこの不具合を誤魔化す為のものかも考えざる負えない。
　と、憶測で書いたがsteamではないレビューサイトの約一年前の書き込みでもスペックが足りていてもフリーズが多発していると書かれていたため、作品の人気に胡坐をかいて直す気が全くないようである。このようなコメントは嘘が多いと考えていたが、公式であっても事実を適切に集めずに間違った情報丸呑みすることがよほど恐ろしいということを知らず、まんまと騙されてしまった。
　自分が一番反省すべき部分として、フリーズ関連を公式が修正したと言ったことを信じ切ってしまったという一点である。たとえ相手が騙す気が無くても事実かどうか熟考すべきである。

　最後にこのゲームは最高に面白いが、システムは死んでいる。フリーズ関連のアップデートが来てそれに関するレビューに問題ない場合か、フリーズの嵐にストレス無く耐えることができる場合のみに買うか検討してもいいレベルであるため、今現在買うことはお勧めできない。",,,,,,0
284,284,76561199196592506,2947,True,0,"音楽とキャラのおバカさ加減が個人的にドハマりでした！
BGMに関して、かっこいいもの、町の探索をしたいと思えるノスタルジックなもの、色々揃っててどれも捨て曲なしのハイクオリティです！",,,,,,0
285,285,76561198983004868,10042,True,1,最初はとっつきづらいのですが、物語を進めていくうちに面白くなっていきます。ペルソナシリーズでは、一番のオススメです。,,,,,,1
286,286,76561198044688566,2970,False,6,"自分の環境だと結構な頻度でクラッシュする。セーブせずに続けてクラッシュを繰り返して心が折れました。
サポートに書いてある方法を一通り試したが全く改善しない。
自分の環境ではゲームとして成立していないと思う。

問題ないとの声もあるが、気を付けて購入したほうが良い。",,,,,,0
287,287,76561198344322883,3095,True,1,it sucks,,,,,,0
288,288,76561199172773503,5924,True,0,素晴らしいゲーム体験を提供してくれたスタッフたちに感謝,,,,,,0
289,289,76561198193032982,723,True,0,とりあえずBGMが神。具体的に言うと backside of the TV と  Reach Out to the Truth- First Battle がツボ。サントラ買いました。,,,,,,0
290,290,76561198987621400,5998,True,0,"ペルソナシリーズの中でも特に全体的なバランスがよく、誰にでもお勧めできる作品です。
ペルソナシリーズや他のアトラス作品への入門としても薦められます。
とはいえ、アトラス作品ですので油断するとあっという間にゲームオーバーになりますので、ゲームを普段プレイしない人は注意しながらのプレイをお勧めします。",,,,,,0
291,291,76561198053356550,215,True,1,ダンジョン内でのカメラの向きを変えるコンフィグが変更不可能で、困っていたが、なんとコンフィグのコントローラーではなくて、「GAME」のところで「カメラ反転」をONにすれば解決しました。これであとは、PS4コントローラー接続時に勝手に音声がコントローラーに変更されるのだけ我慢すれば快適にプレイできそうです。,,,,,,0
292,292,76561199159260852,8045,True,0,"マジで面白い
神曲しかない",,,,,,0
293,293,76561198189591470,20,False,6,バグが多く製品として成立していない。,,,,,,0
294,294,76561198171755337,5647,True,0,"結構前に遊んだペルソナ3ポータブル振りにペルソナシリーズをプレイしましたが、難易度ノーマルはかなり遊びやすくなっていて助かりました。
戦闘曲や自由行動時に流れる曲が良く、戦闘システムが好みだった事もあり最後までとても楽しくプレイできました。",,,,,,0
295,295,76561198412219281,34599,True,3,"以前よりアニメとか見て雰囲気好きだなとか思ってたので思い切ってプレイ。

基本スタイルは往年のRPGよろしく、ストーリーを見ながらじっくり遊ぶゲームです。

ストレートに刺さったし、普通に楽しいし、キャラ一人一人のストーリーが楽しめるし、感情移入したら泣ける部分も多くて、これが2000円で遊べるってんだからいい時代になったもんだと思いました。

Vita版からほぼベタ移植だけどフルHD画質化しているので今のゲームのグラフィックに慣れていても違和感なくプレイできて満足です。

とにかく雰囲気だけでも好きそうだな〜と思ったら是非やって欲しい、そんなゲームです。",,,,,,1
296,296,76561198828315391,1158,True,0,ますたぴ,,,,,,0
297,297,76561198118069616,33,False,3,P5やった後だと古さが目立ってプレイを続ける気になれなかった,,,,,,0
298,298,76561199180031422,1293,True,1,神ゲーです。BGMがとても良い。,,,,,,0
299,299,76561199148036256,375,True,1,"初プレイですが面白いですね。
おすすめです。",,,,,,0
