,number,steam_id,playtime_at_review,voted_up,votes_up,review,story,graphic,character,music,Operability,story_state
0,0,76561198174378099,1217,False,1,"面白くないんじゃなくて合う合わないが激しい
メガテンとかP1~3位の暗い感じが好きな人は多分ノリ軽すぎってなると思う
面白くないわけではない　ストーリーよんでる途中でアンストしただけで・・・",,,,,,-1
1,1,76561199144381259,5935,True,0," P4Gは、女神転生でいうところライトーロウ、光ー正義　明るい物語で正統派の物語です。
人間関係は、曲もなく？安心感があります。　多少諄いかも。
システムは、ほぼペルソナシリーズの基本の完成形に成っていると思います。
　時間さえあればお試しを。",,,,,,0
2,2,76561199149171766,7458,True,0,omoroi,,,,,,0
3,3,76561199065791903,3155,False,1,"未だに起こるクラッシュで数時間が簡単にパーになる。
ペルソナ作成にもダンジョンにも日常パートも馬鹿みたいに引き延ばされて時間がかかるJRPGゲームなのにこれはない。
そういう意味では昔やったVita版の方が快適だったかもしれない。ロードやセーブは遅いが数時間がクラッシュでなかったことになることはなかった。据え置き版も出ているしあえて今Steam版買う意味もないかと。",,,,,,0
4,4,76561198828512034,5074,True,0,"[h1] 自分自身と向き合える強い心が、“力”へと変わる…[/h1]

ジュブナイルRPGとして最高のヤツでした。仲間が全員本当に良すぎる。
1週目はネタバレを受けないようにやり込むことを是非オススメします。

が、↓（核心には一切触れていないアドバイス）
[spoiler] 最後のエンディング分岐だけは調べないとアレなので、セーブを分けてクリア直前のデータを残しておくことを推奨！！！！ [/spoiler]",,,,,,0
5,5,76561199175821461,1514,True,4,"ペルソナは初代と２罪のみプレイ済みのオールドファンです。高校時代などもはや忘却の彼方にすっ飛んだプレイヤーですが、ペルソナ味の高校生活はまぶしくて楽しくて、愉快な仲間と過ごしているうちに心まで若返ったような爽やかさを覚えます。初代や２と異なり、悪魔との複雑な交渉をする必要もなく、ライトな作りながら、弱点を攻められると自由にペルソナを付け替えられない仲間のために、色々と頭を悩ませています。金策も手段が豊富なようで時間のやりくりが難しく、いざ中ボス戦に挑むと想定レベルより低いことが多くて苦戦を強いられてますが、それもまたプレイの楽しみ。
惜しむらくは短時間でちょこっとダンジョン潜って～の、ちょっと学生生活にいそしんで～の、今日は仲間と遊んで～のという隙間時間でのプレイがしづらく、がっつり時間をかけたプレイをしたくなること。あと、戦闘中のクマのボイスがだんだん鬱陶しくなってオフにしちゃったことでしょうか。
仲間もいよいよ５人目、主人公と仲間たちが立ち向かうべき敵はいかなるものか、いろいろと想像を巡らせて、また時間を見つけてプレイしたいと思ってます。これは５も楽しみ。

ぐぬぬぬ…　情報をなるべく見ずに２周目終わりましたがベストエンディングへの道は遠い…　でも
[spoiler]菜々子ちゃんに「お兄ちゃんと結婚したい」[/spoiler]と言われたので、それを夢見て３周目頑張るぞ～！",,,,,,0
6,6,76561198093733838,5888,True,0,"Vitaでこのゲームをやってたあの時が、自分にとっての青春でした。
自分の中で1番思い出深く、大切な作品です。
",,,,,,0
7,7,76561198120522439,2145,True,0,色褪せない面白さ。画面もきれいになってて良い。,,,,,,0
8,8,76561199149206771,7311,True,1,"core i7 12700 オンボードUHD770 動作快適です！
自分にとってはセリフ回しも面白くてあきずに最後までプレイできた！
まだプレイしたことない方はこのゲームおすすめです",,,,,,0
9,9,76561199309621964,3437,True,0,５のロイヤルプレイして「なかなかの良ゲー」って思ってたけどまさか４がそれを超えるとは...もともとはプレツーのゲームだからグラフィックはどうかと思っていたがむしろこのグラが好きになってしまった！音楽も全て神。特に戦闘曲の「reach out to the truth」って曲めっちゃ好き。二周目行ってきます,,,,,,0
10,10,76561198357260735,4577,True,0,9/10,,,,,,0
11,11,76561199403995839,4404,True,2,"人間の内面がすごく複雑かつきれいに描かれていて、主人公たちが真実に向かう姿が生きる糧になった。
現実の自分が励まされているような、不思議なゲームだった。",,,,,,0
12,12,76561198066990672,16215,True,0,"10/10, one of the best game",,,,,,0
13,13,76561198130080196,13888,True,0,,,,,,,0
14,14,76561198018625414,1283,True,9,"[h1]ペルソナシリーズ揃い踏みの先駆者[/h1]
日本語対応、コントローラー対応

音楽、グラフィック、システムどれもバランスが良く
ペルソナシリーズの中でもかなり高評価なタイトル

3からのスタイリッシュ路線を引き継ぎつつ
4で昇華、5で進化した感があり
そのどれもが2023年Steamで遊べるようになった！
非常にメデタイ
4は諸事情あって田舎に引っ越した主人公を取り巻く
学園系、徐々に仲良くなる仲間と問題を解決しつつ
青春を満喫できる

難易度調整もキッチリしているので最初はsafetyからあそんで
周回要素を回収、主人公の能力は引継ぎできるのでそれを利用して
全実績解除を狙うのがいいと思う

[code]
Steamキュレーターで紹介しました
[URL=https://store.steampowered.com/curator/41056472/]「3D酔いでもゲームがしたい」[/URL]　[URL=https://twitter.com/_Rlyeh]Twitter[/URL]
毎日更新してます！
[/code]",,,,,,0
15,15,76561199179061331,10200,True,2,シナリオ、BGM、キャラ設定やそのグラフィックまで全ての点において魅力的な作品。JRPGの頂点であるといっても過言ではない。,,,,,,0
16,16,76561198345554748,5442,True,0,"初の女神転生シリーズでしたがとても楽しめました。
何と言ってもキャラとBGMが最高ですね。ほんと全キャラ愛せます。
主人公は所謂無口系ですが選択肢が豊富で感情移入し易かったです。
それにキャラの掘下げが上手で関係を深めるのが楽しみでした。

ただ戦闘が中々しんどくて途中で難易度下げてしまいました。
自動生成のダンジョンも冗長に感じてしまう要因かもしれません。
あとは3Dモデル（特に顔）がきつくて着せ替えしようと思えなかったです。",,,,,,0
17,17,76561198167366292,3918,True,0,"バトルが冗長なこと以外完璧
感動した",,,,,,0
18,18,76561199189895077,15828,True,0,良い,,,,,,0
19,19,76561198298964863,8050,True,0,"ストーリーは面白いしキャラも魅力的
でもゲームとしてそこまで高評価されるものなのかは疑問
",,,,,,1
20,20,76561198967564538,3075,True,0,ゴールデンが遊びたかったので非常に満足,,,,,,0
21,21,76561199230972826,655,True,0,so far this game is amazing,,,,,,0
22,22,76561198170776522,4585,True,0,最高です,,,,,,0
23,23,76561198341260767,72437,True,3,"ストーリー、キャラ設定、バトル、システム、音楽、どれをとっても最高のゲームです。人生最高と言っても過言ではない。ハマりすぎて4周もしてしまいました。

初見の方はwikiなどを見ずに1周目をクリアすることをお勧めします。どうしても難しければ、難易度を下げればどんなにゲームが苦手な人でも外部情報なしでクリアできるはず。2度おいしいゲームを1周で食べ尽くすなんてもったいなさすぎる！

ちなみにですが、P4Gがあまりに楽しかったので新女神転生3、P5Rにも手を出しました。しかし自分的にはイマイチな感じでした（とはいえ、どちらも面白かったのでおすすめではあります）。
P4Gは重たい展開もありますが、基本的にお馬鹿でコミカル。でも悩んで悩んで、それぞれが自分なりの答えを見つけていく高校生な青春ライフがメイン。それに対して（メガテンは言わずもがな）P5Rはオープニングからウルトラヘビーな展開で、終始ハードボイルドなストーリーでした。それはそれで好きなのだけど、自分的にはストレスなく楽しめるP4Gがやはり最高。

もう一度言います。初見はwikiなしを強烈にお勧めします！強くてNEW GAMEな2周目なら、基本早送りで進めればALLコンプリート目指してもあっという間にクリアできますから、ぜひP4Gの世界を楽しんでください。",,,,,,1
24,24,76561199045269362,24572,True,7,記憶を消してもう一度だけ、もう一度だけでいいからこのゲームをしたい。,,,,,,0
25,25,76561199165359462,2962,True,2,"町で発生した殺人事件の解決のため、仲間たちとダンジョンに潜るお話。ちなみにペルソナ4とはなっていますが関連性も薄いのでここから始めて全く問題ありません。

まずはじめに言っておきますが、ペルソナ５には足りないけどペルソナ4が買えるくらいの残高があって気になっている人でもない限り、ペルソナ5を先にプレイしてみることをおすすめします。
なぜかというと、グラフィック、操作性、UI、ダンジョンのやりごたえなど、ペルソナ5で大幅な進化を遂げているからです。
特にダンジョンは、ペルソナ5と違いランダム生成ダンジョンになっており、ギミックも少なく淡々とバトルを繰り返すだけになっています。バトルでも、敵の弱点を突きにくく道中の敵もそこそこ強い設定になっているので爽快感もあまりありません。高難易度の歯ごたえを求める人でも、ペルソナ5で高難易度設定でプレイする方が楽しめると思います。
ちなみに本作のバトルBGMはめちゃくちゃいいのでおすすめですが、ペルソナ5でもバトルBGMに設定できますよ。

ここまでペルソナ5を先にプレイしてほしい理由を述べましたが、もちろん本作独自の魅力もあります。
個人的にシナリオはシリーズ随一だと思います。殺人事件の解決という戦う目的が他作品に比べ現実離れしすぎておらず、プレイヤー自身も犯人の考察ができるので没入感があります。
また、絆を育む相手がペルソナ5では政治家など高校生とは縁がなさそうな相手のことも多いですが、ペルソナ4では部活仲間やバイト先の関係者などで、わかりやすく充実した高校生活が送れると思います。

正直どちらも、というかペルソナ3までプレイしてほしいですが、シリーズを初めてプレイする方の助けになれば幸いです。
あと、ゲーム内でやたら舞台の町について田舎だって強調されるんですけど都会に見えるのは私だけですか？",,,,,,0
26,26,76561198839795339,1512,True,3,"日本の伝統的なRPG。
ターン制コマンドバトルのRPGが好きな人におすすめ。

少し文句を言うとやりたいことが全然出来ない。
ちょっと何かしただけで一日が終わってしまう。
時間だけが過ぎていく。ゲーム内もリアルでも。
全ての人々と話してから一日が終わって欲しい。

あと自由に動けるように見えて自由度は全くない。
攻略サイトの通りにしないとバッドエンドになる。

まぁでも菜々子が可愛いからグッドです。

追記
このゲームで全ての女とつきあおうとしてる諸兄に告ぐ。
君のその行動はペルソナを強くするためなんかじゃない。
現実でもてないから、ゲームでもてようとしてるだけだ。",,,,,,0
27,27,76561198809743032,3888,True,1,後10年早くプレイしたかった。,,,,,,0
28,28,76561199106273144,10951,True,2,"文句のつけようのないゲーム。シナリオ良し、キャラ良し、BGM良し、ゲーム良し。一年分の時間を過ごすゲームだけあって時間はかかりますが、かけた時間に見合う感動を得られました。
ゲームとは関係ない部分ですが、トレーディングカードのデザインも良く、壁紙に使ったりしています。",,,,,,1
29,29,76561198136102066,9084,True,0,"前提として超面白いゲームなので買うべきです。
以下レビュー。

※Radeon製GPUユーザーへの注意(23年1月時点)
・既に他レビューにも報告されていますがRadeon製GPUを使用している場合、相性の都合でロード時のクラッシュが頻発しゲームプレイに重大な支障をきたす場合があります。
ドライバのバージョンを22.5.1にバージョンダウンする事でゲームクリアまで支障なく快適なプレイが可能であった事を報告致します。

☆プレイ時間目安。
・真エンド到達済み。到達時のセーブデータの時間は88時間。ゲーム起動時間は151時間。
過去シリーズ未経験、攻略サイトでの攻略情報を参照せず完全初見からのクリア時間のため所要時間は前後します。


☆ペルソナ４はどんなゲーム？

・このゲームはJRPGに青春シミュレーターの要素を組み合わせたゲームです。

・あなたは両親の仕事の都合で親戚の家に預けられ、都会から田舎町へと転校してきた高校ニ年の男子生徒です。
転校してきた４月から翌年の春まで、都会に戻るまでの約一年間の田舎暮らしを体験します。

・転校してきた田舎町では不可解な事件が発生し、プレイヤーであるあなたは学生生活を送りながら事件の真相を追い求めることになります。

・作中時期は2011年4月。オリジナル版発売時期である2008年はまだガラケーが主流で、アナログテレビがまだ視聴可能、大型スーパーのイ○ンはまだジャ○コと呼ばれていた時代でした。
そうした時代の青春とノスタルジックを今の時代だからこそ一度、あるいはもう一度追体験してみませんか？




☆ゲームプレイ

・戦闘部分はターン制のJRPGで比較的オーソドックスなシステムです。難易度はNormalでもそれなりに歯ごたえがある方だと思いますが、レベルを上げていけばクリア出来るバランスで、苦戦を感じた場合もコンフィグから難易度調整が随時可能です。


・全体の期日はおよそ１年ですが、事件の真相を追求するあなたには一定期間ごとにチェックポイントとそのノルマ（○月○日までに特定ダンジョンをクリアする事）が定められています。
・事件の一方で日常は維持され続け、登校日には学校に通う義務があり、期末テストの日はやってきます。
そうした日常を送る中で一日をどう過ごすかはプレイヤーには多くの自由裁量が与えられており、あなたはカレンダーと天気予報を確認しながらスケジュールを組む事が可能です。
一例としてテストに備えて図書室で勉強、部活動に入部し友人と過ごす、事件の真相を追う仲間たちと親睦を深める、アルバイトを行う、河川敷まで釣りに出かける等々……事件の真相を追う事だけが学生生活の全てではありません。
やり込みプレイでない限りは全体スケジュールには余裕があるので思い思いの一年を過ごしてみましょう。


☆あなたの青春を謳歌しましょう。
・季節が巡る中で様々なイベントが発生します。夏には林間学校や海へ、秋には文化祭、冬にはクリスマスやスキー、あなたはそうしたイベントを体験する事が可能です。
・青春に欠かせないのが恋人の存在です。恋人候補が複数存在し、あなたはその中の一人と特別な関係になる事が可能です。恋人になればクリマスイブ等で特別なイベントも発生します。
・……実は候補全員を同時に恋人にする事も可能です。その場合、時に女性たちを泣かせる事になるかもしれませんが、あなたを好きという気持ちは変わらないでいてくれるでしょう……。


☆総評
・PS2時代の発売をオリジナルとする古いゲームですが、高いプレイアビリティ、優れたシナリオ・世界観を有する本作は今なお色褪せない面白さをプレイヤーに提供してくれます。
過去作のため値段も相応にお求めやすくなっておりますので、ぜひ一度ご自身の手で体験してみて欲しい名作です。",,,,,,1
30,30,76561198262430358,410,True,0,"2023年1月/21日　更新
どう頑張っても10月から抜け出せなくなったので、プレイを辞めていましたが、
64bit対応のアップデートが入っていたので、一縷の望みを掛けたところ、
2週間分くらい正常に進められました。

低評価取り下げます。神ゲーです。ありがとう。
ーーーーーーーーーーーーーーーーーーーーーーーーーーーーーーー
【環境】
AMD Ryzen5 5600X
AMD Radeon RX6600XT
RAM 16GB

AMD環境と相性悪いんですかね。
ローディングのタイミングでクラッシュします。
→右下テレビのマークが固まったらクラッシュの合図

とりあえずクラッシュの回避方法として試したのは以下の2つ
１．Steam → プロパティ → 一般 →「ゲーム中にSteamオーバーレイを有効にする」のチェックを外す
２．AMD Radeon Sosftwareを起動 → P4Gを選択 → Radeon Chillを有効 → 最小/最大FPSを60に指定

１．の方法で多少マシになりましたが、それでも解消せず...２．もあまり効果がなく...という感じで詰んでます。
5月2日の朝から放課後に行くタイミングでクラッシュします。
ペルソナ4はPS2、Vitaも買っていて、ようやくPCでできる！と思った矢先にこれなので非常に残念です。
3と5RもPC版出てくれるので買うつもりでいましたが、4がこれだけクラッシュするとなると、購入は見送りになりそうです。

アトラスさん、アプデ待ってます（切望）

※8月5日 追記
以下の方法を試すと多少改善が見られました。それでもやはりクラッシュしますが...
・ゲームオプションからネットワーク機能をOFF
・セーブデータを別スロットにセーブ
・Steamクライアントを再起動
なんとか10月までは進められましたが、精神的に結構しんどいです。
何と戦っているのか分からなくなります。",,,,,,0
31,31,76561198804002720,4206,True,1,"女神転生が好きでペルソナにも手を出しました
ペルソナシリーズは本作が初めてでしたが滅茶苦茶おもしろかったです。

☆良いところ
・ゲームテンポが良い
戦闘時/非戦闘時どちらもゲームバランスが良いです。
シンボルエンカウントなので自発的に戦闘を回避することができます
無駄なエンカウントで時間を使うことがないのが楽でした
戦闘中はスキルモーションが短くサクサクとターンが終わるのでストレスが溜らない

・ストーリーが上手く出来ている
序盤から展開されるテーマについて物語が進むにつれ真相究明も進行していき最後には全てが繋がるよう出来ています
時折起きる何気ないイベントにも伏線があり、最終的には主人公の選択肢として現れる為プレイヤーが考えることも大事です

・友情がまぶしい
仲間ごとに友情ランクがありもちろん上げると特典があります
限られた時間の中で遊び、コミュニティを広げるのも本作の魅力です
キャラクターごとにそれぞれの思想があり友情を深める中で愛着が湧くことでしょう
高校生活という青春を第三者から見て満喫できるプライスレスの感情も得られます


★悪いところ
・サブクエストの条件がだるい
メインシナリオと並行してNPCのお願い/お使いをこなすことで報酬を得ることができますが
決まって現在進行中より前のダンジョンから素材が指定されます
当然レベルが低い敵を狩り集めることになるのでこれらを全てこなしていくと相当な時間がかかります
ワンパンで死ぬような雑魚狩りを続けるのはなかなか苦行に感じました

・コミュニティ上げにはカンペ必須
友情レベルを並行してあげるのはかなり難しいです
具体的には親交を深めて相手から掲示されるイベントに進むことで上がるのですがシチュエーションごとに上がり幅が変わりそれだけ考えて進めるとキャラ同士の予定が重複することが多いです
プレイ中はネタバレが嫌なのでエンディングまで事前情報なしでクリアしましたが後から見るとチャートが無い限りは3～5個のコミュをMAXにできれば上出来だと思いました

・エンディング条件が厳しい
1週目は唐突にBADエンドを迎えました
ネタバレになるので皆まで言いませんが一週目で真エンドたどり着けた人はマジで凄いと思います
先に調べるとつまらなくなるのでとりあえずどれかのエンディングに辿りついてから調べることをお勧めします


総合的によくできたゲームだと思いました。
5がSteamに来た今価格が手ごろなこちらから初めてみては如何でしょうか",,,,,,1
32,32,76561199090209649,1779,True,2,PSvitaを持っていなかったので、スチーム版でプレイしたが特に操作がしづらいところもなくコントローラーも接続できるので操作しやすかったし、やっていてとても楽しく感じた。,,,,,,0
33,33,76561198188383069,1072,True,9,"以前だと頻繁に落ちたりする声が多くみられたが、2023/1/19のペルソナ3発売と同時に来たアップデートで以前のバグはほとんど解消されストレスなくプレイできるようになった。
解像度の変更、FPSの変更などでフリーズすることもないのに加えて中断セーブ機能、エクストラコンテンツの追加もあり神アップデートといっても過言ではない。
これでようやく本腰を入れてマヨナカテレビに住めるよ...",,,,,,0
34,34,76561198112094986,38,True,0,"1/19のアップデートでopとムービー以外の音がないバグが修正されてたので
同じ症状で悩まれてたかた一度インストールし直してみては
macのbootcamp環境下です

The  trouble Persona 4 Golden's audio is borked when playing on Bootcamp is solved  on 1/19/2023.",,,,,,0
35,35,76561198263459821,3731,True,0,"語彙力が無いので簡潔に
ストーリー、キャラ、ゲーム性、全てにおいてよいゲームです。
気になったらぜひ買ってほしいです",,,,,,1
36,36,76561199437194716,89,False,0,"本編に入るまで長かった。
というか、1時間ぐらいしても本編に入らなかったので
そのまま返品してしまった。",,,,,,0
37,37,76561199058802628,3368,True,0,ペルソナシリーズは初めて触れるが、とっても面白かった。属性相性と睨めっこしながら慎重にコマンドを選んでいく戦闘は、上手く嚙み合えば一方的な勝利を実現出来ることもあり爽快だった。,,,,,,0
38,38,76561198154081238,11417,True,1,"PS2でペルソナ4自体は経験していたのだが、Steamでこのゴールデンが出ていたのを知り、値段もお手頃だったので購入
今やってもホントに面白いの一言

日本を代表するRPGシリーズだと思います
今度はペルソナ5もやってみる予定",,,,,,0
39,39,76561198393815256,50,False,1,steamdeckでプレイしようとすると、ムービーだけどうやっても日本語になりません。他は日本語音声なのでめちゃくちゃ困る事はないけど、相互性ありマーク付いてでこれは、ちよっとショックでした。バージョンアップで修正される事を願います。,,,,,,0
40,40,76561198103830192,7902,True,1,"[h1]泣いた[/h1]
おっさんによく効くゲームです",,,,,,0
41,41,76561199188277291,4520,True,0,最高,,,,,,0
