,number,steam_id,playtime_at_review,voted_up,votes_up,review,story,graphic,character,music,Operability,story_state
99,99,76561198221018544,985,True,7,"セールで75%offになっていたので購入。シリーズは初プレイ。ストーリークリア時点での感想。

PROS
・ステルスとドンパチのバランスが非常に良く、テンポ良く進められるため時間を忘れて没頭できる。
・アサクリのアクションとゼルダの伝説の謎解きを混ぜた感じのゲーム。収集要素はfarcryシリーズや一般的なオープンワールドゲーにありがちなもの。
・グラップルフックや弓でロープを繋げて先へ進むなどギミックが多彩
・ストーリーも単純明快でよい。（壮大なストーリーを求める人には微妙かも）
・ステルスパートとドンパチパートの配分が絶妙に良い。ずっとステルスだと疲れてしまうが、ステルスとドンパチが交互に配置されているため飽きずにプレイできる。
・武器の種類がそこそこ多い。（グレネードランチャー、アサルトライフル、毒矢、爆弾矢、火矢など）
・武器をカスタムして性能を上げられる（クラスター爆弾矢やナパーム矢などを作成できる）
・フリー探索モードでは設定をカスタマイズして自由に遊べる（敵の頭を大きくしたり武器の威力を上げたり色々いじれる）
・インディージョーンズ的な雰囲気が好きな人におすすめ

CONS
・オプショナルトゥームの謎解きがめんどくさい。初見だとどうやればいいか見当もつかない物が多々あった。（攻略見て「こんなの気づくわけねえだろ！！」的な。。）
・床が崩れて走りぬけるような強制イベントが初見殺し。何回も死んで萎える。
・ファストトラベルが不便。飛ぶ先の場所がどこかわかりづらい。ロードが長め。
・取り忘れたストロングボックス（武器パーツ）の回収がめんどくさい。
・スキルツリーのUIがわかりづらい。


細かな不満点はあったものの、ゲームとして非常に楽しめたので、セールになっていたら是非買うことをおすすめします。
ストーリーは割とわかりやすい内容なので前作未プレイでも問題ないと思います。",,,,,,0
100,100,76561198288916433,691,False,0,ゲーム進行不可バグになったのでごみです！,,,,,,0
101,101,76561198142081878,651,False,0,70％以降に進もうとすると、落ちます…,,,,,,0
102,102,76561198032953013,703,True,18,"昨年にPS4版をプレイしましたが、セールで安かったので購入
内容もうろ覚えだったのでちょうどいいかなとプレイしましたが、いやーほんとに楽しい

映画を見てるような感覚でプレイでき、ステージはド派手にぶっ壊れる
話が進めば新しい武器やガジェットも増えていき、最初は行けなかったところも行けるようになるなど探検要素もばっちりです

そして何より個人的に感動したのは、PS4版とは比べ物にならないグラフィックの綺麗さでした
当方GTX1070を使っているのでアンチエイリアス以外すべて最高設定にしてプレイしましたが、もうすごいの一言
このグラフィックを見るためだけでも買ってよかったと思いました",,,,,,0
103,103,76561198333784645,2645,True,0,"シリーズ未体験なのでトゥームレーダー初プレイです
購入のきっかけは、YouTubeのプレイ動画で見ていたUNCHARTEDシリーズ（以降UNCH）の、現代で未発見の遺跡探検アクションアドベンチャーの世界観が好きになったこと
とはいえプレイステーションを持ってもなく購入予定もないため
steamでレビューを見て買うことにしましたが、楽しめました
UNCHよりアサシンクリードBF（以降AC）に似た感じでボリュームは少ない

・ストーリー
忘れ去られた古代文明を追って秘境に赴き、幻想的な風景の遺跡に辿り着いて謎を解き明かしていくところは楽しめました
ロストテクノロジーやトンデモギミックの謎解き仕掛けはいいのですが、一部ファンタジー要素が入ってくるのが非常に残念
・謎解き
概ね簡単なので安心で、むしろ収集要素コンプリートの方が難しいです
・操作性
ACのように意図しない動作をすることがあり、
飛び越えられそうな障害物が越えられなかったり、飛び移る場所や掴む場所をうまく狙えずよく落下死します
また、カットインのピンチ演出やボス戦などで意図がよく分からないQTEがあり、
操作性は良いとは言えません
ステルスキル要素が考慮されているのに、しゃがむなどの操作ができないのも残念
・マップ
とてもきれいな風景ばかりですが、
他の人も書いている通り、一本道が前提なのが残念
個人的には先で手に入れたスキル・アイテムがないと取れないような出戻り要素が好きではないので、さらに面倒な仕組みだと思います
・没入感
超人的な身体能力の主人公なのはいいとして、人殺し過ぎです
UNCHは男性だし明確にトレジャーハンターだからプレイしてて割り切れますが、シリーズ未体験だと父の代わりに学説を証明したいだけの娘1人が真理到達のため躊躇なく競合他者を殺してるようにも思えるところが残念

総評は、CS独占ブランドの良ジャンルをPCでも遊べていい買い物だったと思います",,,,,,-1
104,104,76561198804660718,3722,True,1,"CPU　I7　7700ｋ
GPU　GTX1060　6GB
メモリ　16GB
SSD　520GB
HDD　1TB

僕はこのスペックですが前作のTOMB　RAIDER（２０１３）ではフルHDでプリセット最高設定で
更にシャドウクオリティーを中から高にしても余裕で60fpsをキープ

RISE　OF　TOMB　RAIDERはプリセット高設定で60fpsをキープ出来ます。
しかし高設定でも物凄く綺麗で最高設定いらないんじゃね？とすら思えてしまうほど綺麗ですね

前作も非常に面白かったのですが今作も非常に楽しいです！
似たようなPS4のアンチャーテッドは合わなくて終盤でダレて止めた経験がありますがコレは最後までプレイ出来ますね
動かしてて楽しいしララと一体化したような気分になります。また声優さんの演技が素晴らしい（特にララ）

1週目はどうしても道中やクリア後に100%アイテム回収に時間がかかりテンポが悪くなりがちですが
2周目からはストーリーだけに集中すれば長編スペクタクルアクション映画を観たような感覚になりますね

何回やっても楽しいです。新作のシャドウオブも楽しみで仕方ないです！",,,,,,1
105,105,76561198829074212,2304,False,2,終盤のゲートクラッシャーにて、進行不能となりました。大変残念です。,,,,,,0
106,106,76561198294113196,1271,False,5,"前作にて　初トゥームレイダーだったのですが。
過去作品もやってから気付いたのですが、トゥームレイダーってこう言うゲームだったのですね。

操作や主人公のアクションなどが一新される訳ではない…という事。

なので、今回のトゥームレイダーは前作やってる人の一部では「このアクションの繰り返しかー」と思うよ。

まだ未発売の新生トゥームレイダー三作目。私は、もっと安くなってから買おうと思う。",,,,,,0
107,107,76561198200205174,662,True,8,"[h1]真の美しさ、真のアクション[/h1]
アクションゲーム。TPSや謎解きなど、様々なジャンルの要素が混ざったゲームだ。

このゲーム、何よりグラフィックが美しい。ゲーム映像やスクリーンショットなどを見えればよく分かるのだが、[b][u]グラフィックのレベルはマジの映画クラスである。[/u][/b]風景一つをとってみても、その美しさは半端ではない。雄大なロシアの風景をこれでもかと映しだす世界観やリアリティは、トゥームレイダーだからこそなせる業だ。前作をプレイして「グラフィック凄いな」とか思っていた自分がまた度肝を抜かされたのだから、グラフィックの美しさでは引けを取らない作品であろう。

肝心のゲーム内容もよくできている。前作に比べると、トゥーム以外に丸出しな謎が減ってよりアクション性が上がったように感じた。トゥームの謎解きも少し頭を捻れば解けるものであり、シンプルさ故の面白みがある。また、アクションのTPSは前作をしっかり受け継いだものとなっており、撃っていて違和感がなかった。コントローラープレイだったのだが、エイムアシストがしっかりついていて初心者でも撃ち込みやすいものとなっていた。

このゲームでは、時には人以外とも戦わなければならない。熊や犬などの動物を前に戦闘を行うことになるが、ここにもララの野性味、また一人前の考古学者兼サバイバリストとなっていく様子がありありと収められている。また、ララといえば数々のピンチシーンであろう。QTEで表現されるこの展開はサバイバルの雰囲気をありありと映し出しており、とてもドラマティックなゲーム体験ができる。この命を張った限界のシーン描写が、トゥームレイダーらしさであり前作からしっかりと受け継がれたポイントであろう。

究極のグラフィック体験、丁寧なアクション要素、死の淵を行くギリギリの演出はまさに「Tomb　Raider」だ。",,,,,,0
108,108,76561198002252866,2706,True,6,"[h1] 言わずと知れたトゥーム・レイダー・シリーズのリブート第2作 [/h1]

父親が死の直前に残した謎を追い、極寒のシベリアでどったんばったんするという話。
前作で立派な墓荒らしになったかと思ったが、相変わらず吹っ切れていない部分のあるララ先生。
この子が、あと数年で趣味の悪いタンクトップを着たアンジェリーナ・ジョリーになるのかと思うと、感慨もひとしおである。

さて、ゲームとしては前作とあまり変わらず、戦闘要素メインのアクションTPSといったところ。
一応はオープンワールドの体裁になっているが、実質的にはシナリオの進行に従って新規のマップエリアが解放されていく、比較的リニアな造りとなっている。
ステルス要素もあるが、シナリオの都合で「ここは真正面から戦闘してね」という縛りのかかる局面が多く、プレーヤーにさほどの選択肢があるわけではない。

強制戦闘→QTE→時間制限のあるアクションパート→強制戦闘、といった具合に連続でグイグイと引っ張られていくため、アクションアドベンチャーというよりは、レールシューターを遊んでいるようなプレイ感さえある。
これはこれで面白いのだが、じっくり腰を据えて攻略していきたいプレーヤーや、ステルス目当てのプレーヤーには、やや違和感が強いかもしれない。

なお、ところどころにボーナスマップが点在しているのだが、これらはアクションやパズルがメインの旧作を思わせる内容となっており、なかなかに良かった。",,,,,,0
109,109,76561198357594725,1056,True,1,"・女性版アンチャーテッド

アンチャーテッドライクなゲームです。　美麗なグラフィック、お手軽なアクション性、ほどよいボリュームのメインストーリー（のんびりプレイしても20時間程でクリア・ほとんどの収集要素を獲得可能）で比較的サクサクと進めて行くことが出来ます。ただフルプライスで買うことだけはお勧めしません。セールにも掛かりやすいのでその時に購入してくださいお願いしますなんでもしま(ry",,,,,,1
110,110,76561198080780470,39,False,12,"VR対応とのことで購入しましたが、VRで動くのはストーリーの一部だけらしいです。
二週間以上たってるので返金も出来ませんでした。",,,,,,0
111,111,76561198329568608,5,False,20,"VRスプリングセールにて購入。
VR対応とあったので期待し起動したもののHUDではホーム画面から微動だにせず。
もしやと思って色々と調べてみると、ゲーム内のごく一部がVRで楽しめるらしい、ということのようです。

非VR環境で楽しむつもりのない人はご注意ください。",,,,,,0
112,112,76561198186797799,1106,True,0,"グラもきれいでパズルやギミック込みで進んでいくアドベンチャーでスコアアタックなどのやりこみ要素もある。ちょいちょいサブチャレンジなんかもこなして大体18時間ほどでクリア。
ストーリーはシリーズ初めての自分でも楽しめたが前作から引き続きでているキャラとの関係がちょっと分かりにくかった。",,,,,,1
113,113,76561198106884312,1504,True,0,这个劳拉玩着真爽,,,,,,0
114,114,76561198448906537,1688,False,7,"一言でいうと【前作経験者は微妙】です

【戦闘】
前作は武器の種類入手タイミングなどがしっかり考えられており戦闘が楽しかったが
今作では最序盤に毒矢という最強装備が手に入ることによりバランスが崩壊している。
前作経験者には最序盤でグレネードアロー(消音）が手に入るようなものといえばどれだけヤバイかがわかるだろう

【武器カスタム】
武器種は4倍近く増えたが強化に必要なものがポイントではなく素材になった。
それだけなら仕様変更で理解できるのだが、各素材の持てる上限が40なので簡単に出るモノは終盤直ぐ上限になる
そのくせ強化に必要な数は20個とか要求してくるのでマメに消費しないといけない。
更に強化システムを前作から流用したせいか装備している武器しか強化できないので
使ってないけど素材上限なるから強化しておこうという際に一々ワンテンポ遅れるのが結構なストレス。

【収集要素】
今回フィールドにある金貨を一定数集めると武器や装備が交換できるのですが
交換できるものが拳銃のサイレンサーやらARグレやらロープを速く渡れる奴だったり前作ではストーリー進行でもらえたものが多いので広いフィールド走り回る労力と釣り合ってない

【ロード】
正直長い。ストーリー進行だけならまだいいがファストトラベル使ってマップ切り替えしようとすると20秒は待つ事になる
ゲームの目的の半分が収集のこのゲームでは致命的に思える。

【ラスボス戦】
ここが一番残念。予想通りの相手ですっげー地味。ここは前作から確実に劣化してます

【総評】
今作から始める人はロード以外不満に思わないだろうけど前作やった人なら別にスルーしてもいいかなといった印象です。前作と比較して武器や装備は増えたが謎解き含め全体的に雑になった感があります。（難易度に関してはnewゲームノーマルで開始した際の印象です）

【余談】
せっかくの女性主人公なのですからもう少しセクシーなコスがあってもと思うのは俺だけなのか
Riseになって衣装は格段に増えたが誰得なのばかりだし、まだ前作の方が女性主人公である表現があったと思う",,,,,,0
115,115,76561198331179084,1044,True,0,"セール時に約2500円で購入。
このシリーズを初めてプレイしたが、特にストーリーに面白いという感想を持った。
特に今作は映画を見ているような綺麗なグラフィックでプレイ出来ると言われておりプレイしてその評判の理由を実感した。
比較的高い設定をGTX 1060 3GB DirectX12有効の環境で60fps、時々45fpsになるがプレイに支障はないので設定を変更せずプレイしている。",,,,,,1
116,116,76561197970673758,2348,True,0,"直近のパブリッシャーウィークエンドにて購入しました。

謎の組織との対決という前作を受け、本作では父の遺志を継いだララが命の源とよばれるなにかを求め、ウラル山脈の奥地にある旧ソ連軍の探索拠点や先住民族の村、そしてかずかずの遺跡群をめぐる旅にでます。

システムは前作同様、スキルや武器強化要素と進化したフリーローミングのシステムを備え、ノーマルでは、少しゲームに慣れた人であれば誰でもクリアできそうな、ほど良い難易度でより遊びやすくなりました。また、様々な行動によって得られる経験値とキャラクターレベルごとに与えられているスキルをアンロックしていくことでゲームを有利に進めることができますが、その取得が難易度を破壊的に変えてしまうことはありません。キャラクターを地味に強化する、The Witcher3: Wild Huntに見られるものと同じ仕組みになっています。

ある瞬間に詰まったと感じる謎解きも、大抵は特殊な装備が不足しているかあるいはやり方を間違えていることがほとんど。その場合は別の場所を探索して戻ってくるか、違う方法を試したりよく観察することで解決策が見つかるという親切な設計になっています。初代に始まってシリーズ追うごとにありえない難易度になっていってしまったアクションについても、旧作すべてに比してシビアなタイミングを要求される箇所はほぼありません。

もし、メインの探索に疲れたら柵の中から逃げだしたニワトリを追いかけるのもいいかもしれません。
",,,,,,0
117,117,76561198119220473,105,False,3,vrぷれい　できない,,,,,,0
118,118,76561198346989717,1557,True,0,"前作プレイ済みで今回購入。
出来は最高ですね。前作をより強化した感じです。スキル、武器共にかなり増えてますし探し物もやりごたえあり。前作やった人もやってない人も是非プレイしてほしいです！",,,,,,0
119,119,76561198335884395,2170,True,0,"まずグラフィックが素晴らしい。
映画的なムービー、差し込む光、雪の表現などは今やっても感動できるレベル。
戦闘は若干単調な感じがするが、映像美を堪能したい、探索好きな人にはお勧め。",,,,,,0
120,120,76561198002006133,1753,True,1,"トンボ2016
いつも通りストーリーは最高の出来
ララちゃんは年々若返っていく
マップも古代遺跡等人が立ち入っていないような場所が多い
ファン要素も盛り込まれているので2周ぐらいしても良いかもな


バグが多いのでそこはよろしくない
[b][url=http://steamcommunity.com/id/comingsoooon/screenshot/918037462607103050] 棒立ちしたMOB [/url][/b]もいたしどうなってんだこれ",,,,,,1
121,121,76561198418281011,552,True,0,不用多说   给力,,,,,,0
122,122,76561198155281932,1174,True,0,"まだやってる最中だけども楽しい。
けど一つだけ言いたいことがある。
水中で死にそうになってるときでも弓矢作れとの催促はやめてくだしあ(´・ω・｀)",,,,,,0
123,123,76561197963842710,3912,True,0,good,,,,,,0
124,124,76561197986724543,3264,True,0,セールでDLCを購入。クロフト邸を探索しました。前作もプレイしていて、早く続編をやりたいと再度思ってしまった。,,,,,,0
125,125,76561198030973234,3398,True,0,"とびっきりの美女のララさんを操って遺跡探索をするアドベンチャーゲーム。
操作性も良く、画面もきれい。",,,,,,0
126,126,76561198167947525,879,True,0,good,,,,,,0
127,127,76561198073311139,803,False,20,"全編単調だと感じました。

当方はダークソウルやスカイリムなど、いろんな敵、シチュエーションがあるゲームが好きで、期待して購入したのですが、
いつまでも同じようなシチュエーション、敵の倒し方も瓶投げて暗殺するだけ、強い敵もただアーマーとか盾を持ってるだけ。
世界も広いわけではなく、10時間で終わってしまいました。
結局R3を押し続けてハンターモードを維持するだけです。
派手なアクションを期待するものではないでしょう。",,,,,,0
128,128,76561198200172543,1431,True,6,"ポニテがお好き？ 結構。ではますます好きになりますよ。

イギリス美女ララさんと遺跡を探索(破壊)するゲーム
ポニーテールお姉さんが好きなら迷わず買いです
タンクトップは序盤だけなのでそこだけ注意
",,,,,,0
129,129,76561198091621598,1281,True,1,こういうタイプのゲームは基本苦手なんだけど、これはストレス無く楽しくプレイできました,,,,,,0
130,130,76561198027633088,1429,True,2,"ニューゲーム＋がほしいです。
































































































































































",,,,,,0
131,131,76561198124771626,1271,False,2,グラフィック、話の内容的には良いんですけど、投石器のあるステージでハンドル回そうとアクセスすると、見えない敵から攻撃されて先に進めない・・・・。何時間も繰り返してるので、もう嫌・・・・,,,,,,0
132,132,76561198041284758,1349,True,37,"シンディー・クロフォードのタンクトップ姿に、私は子供の頃、
激しい性的欲求を感じました

大人になった今でも、目を閉じれば、
すぐに彼女の胸の谷間の形作る稜線が目に浮かびます

私がこのゲームを買った理由はただ一つ、
透けそうで透けない、ちょっと透けるタンクトップ姿の
ララ・クロフトを様々な視点から味わいたかったからです

しかし、うれしい誤算がありました

ララ・クロフトの水中シーンでの平泳ぎです

３人称視点によって、すぐ後方から見ることができるのです

開脚と膝を伸ばすことによる
股関節と太もものリズミカルな動きが

思わず、「平泳ぎ」関連でネット検索したほどです

「平泳ぎの後方視点」という新たな観点を提案してくれた
開発者の方々に、敬服の念を禁じ得ません",,,,,,0
133,133,76561198054410410,1651,True,2,このゲームyou  tube で何度見たか　グラフィックのレベルは高いとわかっていましたが私のpc geforce gt  730 でどうかな？と思いましたがたぶんおもいだろうなと思いきや　意外と軽くグラフィックも素晴らしいですね。ゲームの途中で回りの景色に見とれてしまうほどでした。このシリーズは前からずーとやってきたので是非やりたいと思い今、はゲームの途中ですが、面白い　皆さんにおすすめしたいですね。,,,,,,0
134,134,76561198017534746,1288,True,45,"前作よりも確実に進歩。そして確実に改善。しかしながら、やはりトゥームレイダーというより、ララが主役のFARCRYをやっている気分になる。まあしかし、私はFARCRYも大好きなので全く問題は無かった。

相変わらずララは強い。自然への対応力は卓越しており、逆境にくじけぬ強い精神力は筆舌に尽くしがたく、そしてなによりも、少女とは思えぬほどにタフなフィジカルを有しているのだ。
それだけではない。彼女は隠密や殺人に関するあらゆる技術においても超人的である。
たった一人でプロの傭兵十数人程度は簡単に殺すことが出来てしまう。一体何者なんだ・・・。

戦闘は基本的に弓による先制攻撃からの一撃必殺が主になるだろう。
ゆるい放物線を描き飛翔する矢は、思いのほかヘッドショット判定が大きく、簡単に敵を葬ることが可能だ。
物陰にかくれながら移動し、一人、また一人と命を刈り取る作業に夢中になることは間違いない。
そこに慈悲は全く必要ないし、彼女も持ち合わせていない。
とにかく、敵を、たおせ。

そして高いところへ登れ。そこに答えがある。
これはそういうゲームだ。",,,,,,0
