,number,steam_id,playtime_at_review,voted_up,votes_up,review,story,graphic,character,music,Operability,story_state
135,135,76561198103235286,1473,True,43,"前作を楽しんだ人なら、違和感なく楽しめるはず。
グラフィックは進化していますが、プレイ方法やシステムはほぼ前作を踏襲しています。
ストーリークリアだけなら、少しボリューム的に物足りなさを感じますが、同じシステムで続編をだしてくれるなら、それでもよしとしましょう。パズルは慣れてくるに従い、パターンが読めてきて、意外なものはそんなにない。ヒントも適宜あるので、詰まるということはないでしょう。敵が多いステージで難しさを感じたら、難易度を下げればOK。誰でも楽しめる親切な設計だと思います。
今回はシベリアでのストーリーが大半で、終始寒いのですが、寒さによるペナルティのようなものは、追加コンテンツの方にはいかされていますが、本編には影響しません。食料確保、体温確保を本編に影響させてしまうとバランスが悪くなってしまう気もしますが、せっかっくの環境が生かされていないのも少しもったいないかなと思いました。
前作を遊んでいなくても、十分楽しめます。最新グラフィックのゲームを手軽に楽しみたいなら、ぜひおすすめしたいタイトルだと思います。",,,,,,1
136,136,76561198042675286,762,True,2,最高のゲーム,,,,,,0
137,137,76561197960267615,1137,True,15,"リブートできたTomb Raider 2作目も成功！
アクションゲームとしての面白さはやや癖はあるけども不愉快ではない操作性で〇
謎ときに関しては無理のないギミックに留まってて〇
やりこみ勢用のモードも悪くない

スクエニの国内価格設定だけ×",,,,,,0
138,138,76561198155822221,992,True,7,"グラフィック　　　　　　★★★★★
操作性　　　　　　　　　★★★★★
ストーリー　　　　　　　★★★★★
価格　　　　　　　　　　★★★★★
総合評価　　　　　　　　★★★★★

激しいアクションなのに操作性の簡単さがゲーム初心者でもサクサク進めることができる神ゲー。
そして、グラフィックが奇麗すぎる。",,,,,,1
139,139,76561198272246522,2322,True,4,"旧シリーズ１～５、逃亡者以来のプレイ・・所謂旧作ファンの身であるが非常に楽しめた
近年のTPS偏重、映画を意識しすぎた作風を避けてきたが今作は探索要素が強く名に恥じぬ墓荒らしも充実
戦闘はいい意味で大味。バクスタ・弓・ランボープレイ、お好みと気分でやりたい放題
トゥームレイダー（墓荒らし）に歯ごたえのある銃撃戦を望む人には物足りないだろうが

探索はバットマンアーカム、戦闘はファークライ３、ストーリーはアンチャーテッド２・・あたりを彷彿とさせるが
高水準で操作性もよく、全体的な雰囲気で言えばあぁ・・トゥームレイダーやってるなぁと懐かしさを覚えた

気になるのはストーリーが短いこと。破壊オブジェクトや収集品の探索にそれなりの時間を要するとはいえボリューム不足は否めない
ストーリー的に区切りがついてはいるのだが続く気満々なのが余計に物足りなさを助長している点が唯一の問題点だろうか
",,,,,,1
140,140,76561198058500083,1001,True,1,"前作と今作をプレイ。とりあえずクリアはしたので体感を。
システム面は前作をほぼ踏襲しており、細かい点では異なるものの「前作を楽しめた人は今作も楽しめる」は間違いないと思います。
グラフィックがやっぱりすごい。推してるだけあって映画みたいなゲームです。完成度は非常に高い。
最初から最後まであんまり不満なくプレイできました。ちなみに難易度ハードで一部戦闘がゴリ押し必須になる程度の難易度です。
注意点として、DirextX12を有効にしていた場合、最後の最後で強制終了食らう場面があります。
最後のキャンプを通り過ぎたらDirextX12を無効にしておくことをオススメします。",,,,,,0
141,141,76561198053797210,1872,True,3,"絵がめっちゃキレイだけど、ララは前作のほうが可愛かった
今作のララは光のあて具合でめっちゃ不細工ｗ
ゲームシステムは根本的に前作から変わってるわけではなく、追加システムがあるといった感じ。
武器パーツを集めるのが大変なのは前作同様。オレツエーは出来ませんね。",,,,,,0
142,142,76561197972395585,3127,True,3,"ハードランククリア。(17/01/04)
楽しめたので一応お薦めではある。

-----感想
・2013版以降は量産型ステルス系TPS。
　オートロック両手拳銃射撃どこいった。
　無駄にアクロバット的な動きをする操作性はどこいった。
・広い立体迷路と罠がメインの敵であり、
　敵キャラはおまけ扱いだったレイラ時代と違い
　2013版以降は人型の敵の対処がメイン。
　人工的な即死級の罠は非常に少ない。

・パッドプレイ前提のゲームバランス＆システムなので
　スキルと装備が揃うとハードランクであっても
　肉片にされる様な攻撃の直撃受けても耐える事が出来る。
　よって最後まで力押しでの進行が可能。
・プレイ意欲掻き立てる展開ではあるものの、
　2013版と似たストーリー展開(同じという意味ではない)

・初代の様な研ナ○コじゃない(私見)。たらこ唇どこいった。
・初代にあったボキボキ！といった骨折音が無い。
・両手拳銃がレイラ(ララ)の特徴ハズだが2013版以降は
　弓が特徴になってしまっている。弓たのしーけどさ。
・つーか弓以外いらん。

-----環境関連
・(17/01/04)DX12＆日本語環境のラストシーンにて
　""(0x887A001:DXGI_ERROR_INVALID_CALL)""というエラーが発生。
　DX11に変更すると正常に進行する様になった。
　英語音声にすると進行したという報告もあるようだ。
・現在の普段使いPC環境では物理メモリ16G(VRAM8G)積んでるが
　仮想メモリを設定していない場合メモリ不足のエラーが出て
　落ちる事が多いのが不満。
　まぁDarkSoul3等といった他の物でも同じ現象が出るんだけどね。
・DX11とDX12の差はあまり無い。
　なんとなくnVi○ia絡みのDX12化はみんなそんな感じがする(私見)。

-----ちょっとしたベンチ(2016/12/15 修正版)
重たい重たいというレビューがいぱいあったのでA8-3870で試してみた。
システム : A8-3870定格 DDR3-1866(8G) HD6550D(512M) Win10x64
設定：全て低に相当する設定。解像度も800x600に。
ベンチマーク：1周目 26.74fps 2周目 26.48fps 3周目 26.58fps
地熱谷(MAP)での行動：15～30fps相当、大抵19～20fps相当で動作。
過度なフレーム落ちがかなり少なくパッド操作では
結構遊べるレベルで動作。(マウスだとたぶんキツイ)
どこぞのFPS平均値は高いがフレームスキップきつくて
まともに遊べないゲームとは天と地の差。",,,,,,0
143,143,76561198139686233,2837,True,9,"セール時の購入（50%）です。なぜかズンパスが無いので本体のみ。[spoiler] エニッ糞死ね	[/spoiler]

選んで買えばいいんだろうけど、DLC全部で本体と同じような値段とか手が出ません(;´･ω･)

アクションゲーに慣れ始めたけどそこにシューティングの要素が入るとてんでダメな私でも、
難易度下げたらクリアできました。
絵がきれいだったりある程度マシンパワーが要るのは皆さんが書いておられる通りです。
ストーリーも面白かった。中世ファンタジーものが好きな私でもこれは楽しめました。
",,,,,,1
144,144,76561198030769951,1873,True,8,"【良い点】
アクションプレイが苦手でも簡単にスタイリッシュなプレイができる
グラフィックが綺麗
それなりにやりこみ要素がある

【悪い点】
物語の辻褄がおかしい、完全にファンタジーである
ララに限らず身体能力が現実離れしすぎ
フリーMapで自由度が高そうに見えてるが、全くそんなことはなかったぜ


とりあえず1回クリアするまではぶっ続けで遊んでしまうくらい魅力的ではある
ただ、50%OFF より高い金額で買う価値はたぶんない
物語は完全にファンタジーなのでその点に割り切れる人でないと辛い
JRPGのようなやや興ざめする部分がある
(現実には可能だけどそこでそれをするために準備と人を配置するのはありえないなど)

あと、最後の最後で日本語音声だとエラーでフリーズする
(文字化けのウィンドウに 0x887a0001 というエラーが表示される)

エンディングムービーでやってくれるぜ…
とりあえず英語音声、日本語字幕でやれば切り抜けられる

シナリオをまっすぐプレイすればおおよそ20-25時間くらいでクリアーできるんではないだろうか
その時間に見合う金額だと思えば買いである


",,,,,,-1
145,145,76561198070418714,1006,True,2,前作もやりたくなりました,,,,,,0
146,146,76561198083097958,2431,True,2,"結論言うと非常に面白いです。

360でプレイしてましたが、流石の４倍程の容量のＰＣですね。
最高設定で再プレイしてますが、非常に画質が良くなってます。
興味が有れば買いましょう。
損はしないと思います。
内容については、もう言う事も無いので追加機能について書いておきます。

ＶＲが市場に投入され、もう消えるであろう３Ｄですが、対応Ａクラス・ゲームでは最後では？
と思える感じではありますが搭載されてます。

角度によっては目が痛くなりますが、まるで窓から外を眺めるような世界が広がっており、非常に良いです。
前作やスリーピング・ドッグでは３Ｄがメニューにありながらも削除されてしまったSTEAMですが、RISEには搭載されているので、そっち目当ての人にもオススメです。

Aクラス・ゲームでは最後かな？と思いながら楽しんでます。

追記：結構ゲーム本編でフリーズします。エンディングのムービーでまで原因不明のフリーズが連発しました。
設定でダイレクトX12をOFFにすると大丈夫でした。PCなんで所有PCの設定でかなり左右されると思いますが困ったら試してみると良いかもしれません。というか相性が12と悪いゲームなのかもしれないですね",,,,,,0
147,147,76561198075134621,1012,True,10,"DX12　６７００K　
Pascal　TITANX　SLIで４Kフルスクリーン最高設定＋影などをさらに向上させたカスタム設定を選んで垂直同期60FPS安定です。空冷ベンチマークでは平均７８～９８FPS。
簡易水冷SLIで７８～１３０FPS。

グラフィックのレベルは息を飲むほど、PCゲーム史上最高峰だと思います。
効果音、BGM、操作部分から入る演出も素晴らしく進めるのが本当に楽しいゲームです。",,,,,,0
148,148,76561198004002117,2373,True,5,"アクション好きなら是非お薦め。
前作と違い、こちらは最初から日本語対応。
相変わらずの初見QTE殺しもあるが、ゲーム自体安定の面白さ。
謎解きアクションと戦闘アクション。
戦闘はスニークもできるし、それなりにゴリ押しも可能。
近接戦闘もできるが、遠距離スナイプが楽しい。
何だかんだ言っても弓が色々万能なので強化お薦め。

注意点としては、directx12でプレイしていると最終盤でエラー落ちする可能性あり。
これは11に設定すれば回避可能。",,,,,,0
149,149,76561198144749071,2035,True,3,前作の方が面白かった。今作は前作の二番煎じ。,,,,,,0
150,150,76561198069208626,893,True,1,全てが美しい。もちろんララを含めてね。ただし、重い。,,,,,,0
151,151,76561198093102442,1146,True,1,"面白いです。パズルとアクションのバランスが非常によく、グラフィックはまさに圧巻。ぜひ大画面で遊びたい作品です。

残念なのが最後の最後、アナと対峙してるときにジェイコブが駆け込んで来るシーンで突然中国語かなんかの文字化けメッセージでて不正終了します。他の方も報告されてるようなので結構起きるのかもしれません。エンディング見せて～～～～～！",,,,,,0
152,152,76561198069090866,511,True,1,"前作も美しい映像でしたが、今作も最高に美しい映像です。
とてもおもしろかった前作から正当パワーアップなので、
ぜひ、購入してプレイしましょう。",,,,,,0
153,153,76561198095014236,1564,True,1,"総じて高評価

トゥームシリーズは1～4作までとアンダーワールドをクリアした程度です。
今回久しぶりにプレイしましたがQTE等が殆ど無くプレーヤーの直感で対応しないと即死亡という、死にゲー要素はきちんと残しつつマップ内を縦横無尽に移動できる操作性や、本編とは別に用意されたオプショナルトゥームの完成度も非常に高く、サイドをしなければ本編の進行に影響するという事のない適度なボリュームもバランスがいいと感じました。
プレイ時間30時間で達成率90％までいけますが、RPGではないのでこの程度のプレイ時間で必要十分。
DLCで購入できる追加のシナリオもセールなどで安くなったら買ってプレイしようと思います。",,,,,,0
154,154,76561198026946868,277,True,5,弓が大好き。。。。,,,,,,0
155,155,76561198057313345,1493,True,0,Ein muß auf 3D,,,,,,0
156,156,76561198057139712,375,True,3,ストーリーも操作性もかなりいいですね。,,,,,,1
157,157,76561198164375444,2236,True,1,"前作が楽しめたなら、楽しめます。レリックや文献はもちろん、金貨、サバイバルキットといった収集要素を集め始めると時間が溶けていきます。

武器も多くお好きなプレイスタイルでお楽しみを！",,,,,,0
158,158,76561198121111125,884,True,7,"ストーリーも戦闘も結構はまる
ただ自分の環境だけかはわからないけどメインストーリー終盤？の「○○あぶなーい！」って言った瞬間にゲームが強制終了する
エラーメッセージも中国語？みたいな漢字だけの文だからよくわからないし最後の最後でクリアできないもどかしさからやる気がなくなってしまった
改善されたころにまたやりたいと思います
",,,,,,0
159,159,76561198097103476,169,True,129,"ゲームは文句なしに面白いです。
グラも凄いですが、その分マシンパワーが必要…
当方PCでは最高設定のベンチマークで平均69FPSでした。
参考までにスペックを記載します。

OS     : Win10 64bit
CPU   : i5 4690K 4Ghz
MEM : 8GB
VGA  : MSI Geforce GTX1070  8GB
",,,,,,0
160,160,76561198057059410,1523,True,5,"良かった点
　・感動のグラフィックと音響
　
悪かった点
　・ＦＰＳが十分でもプレイ中のローディングでカクつく
　・弾薬などのリソース管理が簡単すぎた
　・鋼鉄のふくらみ",,,,,,0
161,161,76561198117573222,238,True,3,すばらしいです！！,,,,,,0
162,162,76561197992472342,3273,False,196,"前作の良さはそのままに、ひたすら改善をしたような今作
なので前作を楽しめた人はまず今作も十分に楽しめるだろうと思います
グラフィックは非常に素晴らしく、適当に景色を眺めつつ歩いているだけでもなかなか楽しいくらいです
特に雪の描写には力が入っているようで、とても見応えがあります
ゲームシステムは今回QTEは前作と違い、壁から落ちそうになった場合や回避からのカウンターを除いてほとんど無くなったのでQTEが苦手な人も安心です
アイテムの工作は素材のバリエーションが増え、目当ての動物を探したり、より狩りをしている感じが出たんじゃないかと思います
戦闘はいくつかの場面を除いてステルス重視のプレイも可能になっています
難易度は個人的にはあまり高くは感じませんでしたので、高難易度でやったほうが丁度いいかもしれないです

ゲーム自体は非常に良い出来だと思うのですが、DLCを購入するにあたって、何故か日本からはシーズンパスを購入することができません
20 Year Celebrationは本体とシーズンパスのバンドルで$59.99の物ですが、日本ではシーズンパス無しで通常版を7344円です
なのでDLCが欲しい場合には別途に購入する必要があるのですが、コスチューム含め全て購入すると7236円になります
つまり20YCと同等くらいにするには合計14580円払う必要があります
DLCも遊びたい人はここで購入するのはお勧めできません",,,,,,0
163,163,76561197970562132,2533,True,6,"日本語版ではシーズンパスが購入できません（16年9月26日現在）
ですので、シーズンパス同梱のレガシーキャラクターモデルが利用できません。

==(16年10月13日加筆)==
既に個別販売されているDLC以外(ララの悪夢、レガシーキャラモデル等)を購入できるようになりました。
ボリューム的にお得感があまり無いのでララ好きな方は検討してもよいかと。
==================

前作以上にアクションは豊かになっているので、かなり楽しめるかと思います。

やりこみ要素も楽しめる内容ですが、いわゆる「キャンペーンを強くてニューゲーム」はできないので、キャンペーン上ではカスタマイズした武器等を活かせないのが残念です。",,,,,,0
164,164,76561197982318211,2886,True,0,Play Time 42 hours 2016.10.12. Main campaign easy and DLC Baba Yaga.,,,,,,0
165,165,76561198074029945,3029,True,7,"アクションゲームとしては実に面白かった。
ただ・・・前作のラストでのララの象徴的な武器のシーンを見たのに
今作ではそれがないのがモヤモヤしたところ

",,,,,,0
166,166,76561198253086096,930,True,8,前作を好きな人なら、楽しめるはずです。(ㆁωㆁ*)操作わ基本同じです、でも今回のゲームわ色々新しい物が増えました。野生の熊や獅子や狼なとがあります、NPCからの別の任務も面白いです。今回新しい武器と服もメェ~じゃ増えました(弓矢一番好き)、ＤＬＣのストーリーとチーアレンチも最高!　そしで一番変わっだのわ画面です、いいパソコンを持っだ人なら分かる。このゲーム遊び始めたら止まらないde~ze(≧▽≦),,,,,,1
167,167,76561198256730891,3341,True,1,"面白い！！
グラフィック綺麗！！",,,,,,0
168,168,76561198039056718,1034,True,8,"＊若干ストーリーに触れておりますので、ご注意ください


祝・山の日制定。C.W.ニコル、和泉雅子、橋田寿賀子、兼高かおると互角に渡り合える、山ガール兼海ガール兼大工女子兼サバイバリスト兼ナチュラリスト兼探検家というララ・クロフトを主役に据えたシリーズの、リブート作品第二弾。前作は３年前発売。２年前に発売されたThief(2014)とともに、日本語はDLC別売り扱いだったが、社長が交代してから方針転換著しく、今作には時期に関係なくいつ購入しても無料で日本語が同梱するというありがたい特典付き。

今作も、「なぜ山を登るのか。目の前に山があるから」という純粋な動機ではなく、諸般の事情から、宝を求めてシベリアなどを旅する大スペクタクル巨編。敵対する武装集団と引けを取らぬ古代遺産の破壊に次ぐ破壊をもってして目的に到達しようという、犠牲なくして成果なしというトレードオフの精神は変わらない。手段を択ばぬ点でも、悪党と互角である。ただ違うのは、そのお宝の先を見据える認識の相違だけである。

また、ララと、彼女の父親、その父親の後妻におさまろうともくろんでいたと受け取られても仕方のない不審な美貌の女性、ララにストーカーと誤解されるほど献身的な男性という人間関係と、その結末も見もの。特に、誰が死んでしまうのかではなく、むしろララ以外に誰が生き残れるのか、その予測がつけられないほど、周囲の人間をサバイバルという名の不幸に陥れながらも、大人の階段を上る姿をプレイヤーは見守っていくことになる。

前作に比べて、また一段と成長したララの様子をうかがえるはずだったが、それらしい演出は、記憶に頼る限りなかったと思う。前作では、生きるためには動物も殺めなければならないことに対する葛藤と倫理的抵抗、悲しみをこらえて動物にナイフを入れる様子が丁寧に描写されていたが、今作ではそれらのうぶな心や倫理観はすでに死んでいたようで、狩猟（というより乱獲）から人間に対する銃の乱射、即興で火炎瓶や爆弾をDIYするなど、ためらいのたの字も存在しなかった。寒中水泳などたくましさを見るにはいいけれど、前作のような成長を感じさせる演出は期待しないほうがいいと思う。ただ、キャンプで火をともすと、自責の念に駆られながらあれこれ振り返りつつ心を新たにする様子を見るに、完全に人間性を失ったわけではない模様。憔悴しきったためか、シベリアの山々をみて「森は暖かい」というコメントの一つも出せないほど精神的に滅入りながらも歯を食いしばる７０年代的スポ根精神、あるいはどっかのラグビードラマの、「俺はこれからお前たちを殴る」的な悲しみの奥にある炎のような何かが、キャンプの炎によって復活する。


良いところ
スクエニの体質が変わったこと
前作に引き続いての安定したゲームプレイ、特に前作を気に入った人には気に入る内容
定期的に簡単な仕掛けをクリアする任意のチャレンジがあって、仕組みを考えてあれこれするのが面白い
アサクリ的な行動と目的物のアサクリ的相似


悪いところ
筆者の記憶力の問題で、時間をずらして様々な出来事を断片的に出していく演出が、自分の頭の中で時系列を形成することができず、死んだと思った人が生きていて、生きていたと思ったはずの人が死んでいて、混乱してしまった",,,,,,0
