,number,steam_id,playtime_at_review,voted_up,votes_up,review,story,graphic,character,music,Operability,story_state
291,291,76561198233522232,5190,True,2,"とりあえずクリアしたので感想を。
FarCryは３と４をクリアまでプレイ済み。
ちなみに全部ソロプレイで今作もアーケード等は未プレイ。

・満足した点
　・グラフィック、自然、人物ともにリアルで綺麗、探索が楽しい
　・スペシャリストとの共闘が楽しい
　・車、など乗り物系。前作よりも選択肢が増えて楽しい
　・ミッション、PEAK構成の変更、わかりやすくなった
　・幻想（ドラッグ系とか4の古代編？みたいなやつ）イベントが少なめになった（多分）
　・世界観、（ストーリーはだいぶ批判されてるが。。）対カルトというのは面白かった
　・フェイス・シードかわいい
　
・不満な点
　・バグ多め
　　・一部のミッションで進行不能（または進行トリガがバグで解りづらい）
　　・クラッシュして強制終了、80時間ほどのプレイ中に10回以上はクラッシュした。
　・テイクダウン
　　・ナイフが何故ない？近接武器もいまいちでこれは劣化だと思う
　・スペシャリスト以外のガンフォーファイヤを使う気が起きなかった（進行速度による？）
　・基地攻略の難易度が４に比べてちょっと歯ごたえがなかった
　　・４も同じノーマル時。腕に自信のある人は難易度高めの方がよいかも
　・NPCのAIはもっと進化しててほしかった（期待しすぎた）
　・武器のバリエーションが少ない
　　・まあ結局使わないんだけど、減りすぎかなあ

あれ、お勧めですが、不満点が多くなってしまった。
特にシリーズ経験者は好みの分かれる点が多いかな？
総合的にはいつものFarCryとして楽しめました。
バグはそのうちFixされることを期待。",,,,,,1
292,292,76561197998524762,1837,True,2,"シングルプレイをエンディングまで見たのでレビューを・・・と思ったのだけど、概ね他の方々が書かれている内容に賛否いずれも同意。俺が改めて述べることは無いが、少なくともエンディングまでの道のりはほとんど飽きることなく楽しめた。

で、俺の購入の決め手となったアーケードモードのマップエディタ、これは本当に素晴らしい！UBIの他シリーズからも収録された膨大な最高峰のアセットを好きなようにぐるぐると眺め、好き勝手に配置できるってだけでもうCG関係者は買いです。
",,,,,,0
293,293,76561198302930273,2047,False,3,つまらん　以上,,,,,,0
294,294,76561197966675073,2183,False,10,"アサシンクリードの新作が大変良かったのでファークライにも同じように期待をしていたが、
残念ながら期待を下回るものだった。

とにかく戦闘が多すぎる。マップ移動しててたぶん30秒に1回は戦闘に巻き込まれているんじゃないだろうか。
FC2のような戦闘頻度である。もう少し緩急ってものを考えてもらいたかった。
FC4と比べて武器の種類が減少しているのもマイナス。

ストーリーについてもゲーム中、「祝福」と呼ばれる幻覚作用をもたらす謎の薬物が登場し、カルト教団は洗脳等にこれを用いている様子だが
話を展開する上でこれがやたら都合よく使われすぎだし、主人公もこれで何かと幻覚を見せられるのはうんざりだった。
また、毎回カットシーンを見せるために強制イベントでプレイヤーの意思とは無関係に拉致されるのは全然楽しくない。
皆さんレビューで指摘しているとおりエンディングを見た後の脱力感も半端ない。

モンタナのマップの作りやグラフィックはすごく良いのだけれど
ゲームプレイ的な部分はおざなりになっており、過去作より退化したように思う。
正直言ってオススメしない。",,,,,,-1
295,295,76561198194299690,1481,True,2,"カルトを相手に好きなスタイルで大騒ぎ！
　アメリカの田舎町を舞台に悪事を働くカルトと戦う主人公のお話し。
魅力的でサイコパスな悪役たちも魅力だけど、このゲームの一番の売りは自分の好きなスタイルで敵と多々敵と戦えること！
　例えば某メタルギアのように敵地に潜入し相手に感づかれることなく基地一つ壊滅したり、逆に某ランボーのように爆発物とでっかい機関銃で豪快に敵を薙ぎ払うのもよし、武器もいろんな種類がそろえてあるので、道具選びでなり切りプレイができるのも楽しい。舞台がアメリカだってんでリボルバーとレバーライフルもってカウボーイプレイするのが個人的にはとてもおすすめ！
　ストーリー本編は２５時間でできそうなぐらい短いけど、決してゲーム全体のボリュームは少なくない。なぜなら主人公の育成をはじめとして、お宝探しやサブクエスト、さらにゲーム本編とは別に自分で考えたクエストやダンジョンを作って世界中に配信して遊んでもらえるアーケードモードもあるので、はまればかなり楽しめる作品になっている！
　ここまではいいところしか言ってなかったけど、あえて悪いところをあげるとしたら、シリーズ全体としてやることがあんまり変わってないことや、プレイヤーを皮肉ることに焦点を当てたストーリーなどがあげられるとおもう。前者はともかく、後者のストーリーに関しては決してできが悪いわけじゃなくて、人によってはとても消化不良に感じるところが悪いと思う。まぁストーリーがメインな作品ではないので、取りあえず好きなように暴れてみてください！自分をB級映画の主人公に見立ててガンガン暴れて楽しみましょ！",,,,,,0
296,296,76561198278727955,3052,True,2,とにかくグラフィックが綺麗。水の表現◎釣りとか乗り物乗ってるだけでも時間があっという間。,,,,,,0
297,297,76561198196068426,1486,False,3,シナリオが酷すぎる。ツ〇ヤで100円で旧作を借りてきたほうがマシ。,,,,,,0
298,298,76561198387104730,1081,True,2,ファークライ購入したのは今作が初めてですが、いろいろなゲームをしてきて思ったのは物足りなさです。それとヤケに強い動物に、通り過ぎるだけで必ず気づく敵。どちらも正直めんどくさいです。あと無駄に硬い裸のVIP。ありえんでしょ。ただ何故かくせになり、プレイしたくなるのでグッドです。,,,,,,0
299,299,76561198099667932,2257,False,9,"苦痛を乗り越えてクリアいたしました
はっきり言って酷いストーリーです
かなり残念な終わりですね例えるなら「２時間待ってやっと入ったラーメン屋で店主の指がドンブリにINしていておまけにその指くわえてｐｒｐｒされちゃった」みたいに残念な気持ちになりました
戦闘は楽しいです隠れたり派手にやったりはお好みで楽しめますでもストーリーが酷いです
乗り物多めですでもストーリーが酷いです
武器が少なめですでもストーリーが酷いです
アーケードモードはとても楽しいですでもストーリーが酷いです
ハードモードでクリアしましたがちょっと歯ごたえがなかったです（初期体力でクリアできた）でもストーリーが酷いです
日本語吹き替えで遊ばないほうがいいです聞いてて不快でしたでもストーリーが酷いです
とにかくストーリーが酷いです
買うなら99％OFFくらいで買うことをお勧めします",,,,,,1
300,300,76561198339136780,2825,True,2,"[h1] 先にこれ読んで↓	[/h1]
1.FarCryシリーズは初プレイです
2.UBIのゲームは、何本か遊んだことがあります
3.サイドミッションは、まだクリアしていないものがありますが、一応ストーリーはクリアしました
4.〇は良い点、✕は悪い点
5.ネタバレを含みます
6.結論を先に書きますが、とても楽しいゲームなのですが、残念な点も多く、もう少し何とかできたでしょゲーでも楽しめる方におすすめします


[h1] 〇・ストーリーミッション	[/h1]
この点を、不安に思っている方もいると思うので、書いておきますが、Ghost Recon Wildlandsの様なやることが同じで、作業という感じはしません。
[spoiler]ただ、進めている最中は楽しいのですが結局、幹部を2人殺しただけで(1人は生きているのかもわからない)ファーザーを逮捕できるわけでもないので、余りスッキリするエンディングではありません。 [/spoiler]

[h1] 〇・マップとか色々	[/h1]
マップはかなり広いです。
広いだけで中身が無かったり、移動が大変と不安に思う方が多いと思いますが、ちゃんと作り込まれていて、ファストラベルもあるので移動にストレスは感じません。

グラフィックもかなり綺麗で、事前に公開された映像からの劣化は感じません(というか、何も変わっていないと思う)

ミニマップが無い点を良く思われない方をお見掛けしますが、ちゃんと道が舗装されているので
""自分が来た方向も、地図の見方も、東西南北も""
分からない方でない限り問題ではないと思います。
(目的地を設定して車に乗れば、そこまでのルートが道路に出てきます)

ゲーム内に課金通貨がありますが、課金無しで、全てのアイテムが買えますし、課金通貨も探索していれば見つかるので、課金する必要は無さそうです。

[h1]〇・車 	[/h1]
FPS視点での運転になるので、運転のしやすさに関して不安に思う方もいると思いますが、余り癖が無く、フロントも広く、窓から身を乗り出して後ろを見ることもできるので、とても運転しやすいです。

何なら、マップで目的地を設定して、運転席以外に座れば、味方のキャラクターが運転してくれますし(多分車だけ)シフトキーを押せば自動運転になるので、そちらを使うことをお勧めします。

あと、味方のキャラクターを最大で二人連れることができるのですが、定員で乗り物に乗れない場合は、近くの乗り物に乗って付いてきます(無ければ、全力ダッシュします)

[h1] ✕・分かり辛い	[/h1]
敵の運転しているトラックから物資を奪えるのですが、初見だと奪い方が分かりません。
トラックの後ろ側の側面にあるレバーっぽいのを、インタラクトすると奪うことができるのですが、レバーに視点を合わせて、やっとインタラクトの文字が出てくるだけなので、非常に分かり辛い。
乗り物のインタラクト系は、車に視点を合わせて周りを回ってみれば、分かると思います。

一部サイドミッションの近くに行くと、マップから表示が消えます。
これは、バグなのか仕様なのか分かりませんが、表示があった場所を覚えておけば大丈夫です。

人質解放ミッションで、捕まっている人質がどこにいるのかは分からないので、木の陰とかに隠れていると、1,2分探すこともあったり無かったり。

[h1] ✕・のんびりできない	[/h1]
敵がそこら中にいるので、車で走っているだけで、直ぐに撃たれます。

山の奥地の、マップギリギリの、人気が全くない場所に釣りに行っても、敵のパトロールがいたり、航空機でもパトロールをしているので、のんびり釣りをするのは難しい

[h1] ✕・キャラクリが思ってたのと違った	[/h1]
細かい設定は無く、用意されている顔と髪型(色は4.5種類)から選ぶだけなので、余り期待しない方がいいです。

[h1] ✕・犬や熊の味方キャラクターは車に乗らない	[/h1]
乗り物に乗ってくれるのは、人間のキャラクターだけなので、車に乗っていると走って付いてきます。
そのせいで敵に巻き込まれたり、轢かれたりして、いつの間にか気絶していることがあるので、気を付けましょう。

たまに、民間人が味方を轢いて気絶させるので、その時は地獄に送ってあげましょう。

[h1] ✕・音量設定が少ない	[/h1]
音量設定は、マスターボリュームとVCしか無く、効果音や音声などの細かい設定は出来ません。
たまに銃声がうるさくて、NPCの言っていることが聞こえなかったりします。

[h1]✕・理不尽なレジスタンス	[/h1]
ドライブしている時に、レジスタンスが車でぶつかってくる時があるのですが、そうなると問答無用で撃ってきます。
近くのレジスタンスも便乗して撃ってくるので、レジスタンスの車両には気を付けましょう。",,,,,,1
301,301,76561198802463710,1844,False,7,"※ややネタバレ
ストーリー性が気にならない人、ハチャメチャしたい人にはオススメ

エンディングもだけど、ストーリーの要所でボスに強制拉致されるのに耐えられなかった
気づいたら拉致されて、気づいたら味方の要塞で目が覚める　ワッツ？？

",,,,,,1
302,302,76561198274077927,2305,True,0,"http://theroguecaffe.blog.fc2.com/blog-entry-289.html

http://theroguecaffe.blog.fc2.com/blog-entry-291.html

ブログにまとめてみたので購入に迷っているのであれば
一度見て行って欲しい。
基本的には自由度が高いゲーム内容になっている。
賛否両論分かれるかもしれないが、どう楽しみながら
プレイするかはプレイヤー自身で作っていくようなタイプ。
ストーリー進行が強制的に進行していくという特殊な仕様に
なっているがそれはそれでプラスの仕様ではないか？と個人的には思う。
というのはサブミッションばかりやって肝心のメインミッションが
疎かになってしまいゲームそのものを中断してしまうというケース。
プレイヤーを選ぶような仕様になっている部分もあるが内容そのものは
面白い充実した仕上がりになっている。
迷ったらセールになってからでもいいので一度プレイしてみる事を勧めたい。
",,,,,,0
303,303,76561198131144029,989,False,0,mom said dont play.... so i played... mom caught me... now im not playing.. shes playing.. thumbs up 11/10,,,,,,0
304,304,76561198046564137,1330,False,7,"※若干ネタバレを含んでいるかもしれない

良
武器のモデリング、グラフィックなどが極めて綺麗
順当なゲームプレイ
動物の仲間が総じて可愛い
飛行機に乗れる
釣りができる
ラジオ塔を制圧する必要がない

悪
バグゲー
　・ライティングバグ
　　恐ろしいほど室内が眩しくなって何も視認できなくなったりする
　・AIバグ
　　知らないNPCが突然乗り物をパクってどっかに消えていく。味方が指示した場所に行かない。など
　・ミッションが進まない
　　条件を満たしててもミッションが進まず詰み。時間を置いたら治ったりするがその間が極めて虚無

恐ろしいほどやりがいのないストーリー
Far Cryシリーズお馴染みなので前作、前々作をやってるならどういうことか分かるはず。
ヤクと宗教と言えば分かりやすいだろうか。
ストーリーで溜まった鬱憤をついに晴らせるかと思ったらエンディングでより不快な気分になる。
人を選ぶ、とかではないぐらいに不快で、正直リプレイしたくはない。

武器の使い回し
今作はシグネチャー武器がない。スキンを変更したものや見た目が若干変わっているものがあるが、性能はオリジナルと同等。
同じような武器を殆ど採用しているため、面白みがない。
武器に関してはもっと突っ込みたいが、分量が増えるので、特にマグナムとMP5の使い回しが酷いとだけ言っておこう。

謎の課金要素
何故かこのゲームに課金できる。
プレミアムに区分される武器や乗り物は銀の延べ棒という課金通貨で購入できるが、そもそもゲーム内マネーで購入できる上、
銀の延べ棒そのものが今回のマップでたまに手に入る。武器の入手も特に難しいわけではなく、存在意義が分からない。
課金しなくてはならない程資金調達がキツイわけでもない。
もっとも、特にそそられない珍妙なペイントがついた、安価で入手できる通常版と性能の変わらないそれを血眼になって購入する人がいるかも怪しいが

レジスタンスポイントの煩わしさ
今作はレジスタンスポイントを上昇させることによってストーリーが進む。
その地域のメインミッションが残っているうちは問題ないのだが、最後のひと押しでポイントが足りないと非常に面倒なことになる
というのも、メイン以外でのポイント上昇がランダム遭遇、かつ微量にしか増えない。
遭遇するときはするが、出会えないときは出会えない。しかもこなすタスクも極めて単調で面白くない

ストーリーとメインミッション進行バグさえ目をつむれば、そんな悪い出来ではないが、正直に言うと私はこのゲームを好きにはなれない。特にストーリーで抱え込んだストレスの発散法がゲーム内で見つからなかったのが一番の問題点ではないかと考える。オススメはできない。",,,,,,1
305,305,76561197990979996,3295,True,6,"とやかく言われている部分があるが、相当に楽しんだ。

山、農地、斜面、沢、滝そして森林。
なんと素晴らしいことかモンタナ。
グラフィックは最高の一言。
朝焼けに映える針葉樹林の涼やかな様を初めて見た時の感動はクリアしてもなお色あせない。
仲間になる動物達の愛らしさや迫真のモーションは「スタッフよくやった」の一言に尽きる。

UI、これは退化した。
ミニマップはあっても良かった。
武器の選択やボタン配置はあまり直感的では無かった。
3、4が丁度良かっただけに余計な事をしてしまったな、という所。

ゲーム性、これは功罪併せ持ってる。
強化アイテムは形骸化して有っても無くても全く問題なくなってしまった。
クラフト要素はほとんど止めてスキルポイントで強化する形にはなったが、結果してLMGが掛け値なしに強くなってしまった。
武器バランスの調整はちょっと甘いと言わざるを得ない。
狩猟して素材を集める的なものは別に要らないと思っていた口なので、クラフト要素の削減は個人的には歓迎。
定期的に強制イベントが襲ってくるのはプレイヤーのやる気の腰を折るような仕様であまりよくない。
任意イベントでストーリーを進めてくれた方が良かった。

システム全般、これも良し悪しがある。
CO-OP専用のマップを用意してくれていた旧作に比べると、カスタムマップによるアーケードライクなモードはちょっと物足りない。
これはこれで好きだが、4人CO-OPはあって欲しかったなぁと思ったりはした。

ストーリーは結構やらかしたのではないかと思う。
あまり語るのはよろしくないが、悪い意味で「え、そういう展開！？」という風になった人の方が恐らく多いだろう。

総評するとテイスト的にFARCRY2に近い。
2が至高だったと言って憚らない自分としては最高に良かったが、3や4の系譜を期待した人にはちょっと期待外れな感があるかもしれない。

逆にそこにいてこのレビューを見ている2が好きな君。

お前だお前。

これは2の正統な子孫だから買え。

武器はジャムったり壊れたりはしないが、間違いなく2だぞこれは。",,,,,,1
306,306,76561198054820499,4842,True,0,いつものファークライ,,,,,,0
307,307,76561198022924429,4354,True,7,"人間の感情にも道理はある。

人はサッカーボールを蹴るまえに脚を振りあげる。
当たり前のことだ。誰だってそうするだろう。

大切な仲間が死んだとき、主人公は涙を流す。
そんなよくある光景も、結局は死そのものに焦点が向かう。
涙はその場の悲しい雰囲気を醸しだす証拠でしかなかった。

ゲームにおける人間の表情が、死と同じくらい、あるいは死そのものより感情を揺さぶらないのはなぜか。

いままではそんなものだと思っていた。
いくらグラフィックが進化しリアリティ溢れる顔と体が作れるようになったとしても。
たとえばThe Wither 3の主人公ゲラルトの表情はよくできていたけれど。
それでもなお雰囲気をを醸しだす域を脱せなかった。

だがFar Cry 5を最後までプレイして光明を見出した。
俺ははじめてゲームで登場人物の表情に感情を揺さぶられた。
彼らを取り巻く状況ではなく、彼の表情そのものに、俺自身の感情を揺さぶられた。

ストーリー終盤、とある人物が号泣しながら悲しみと怒りの混じった激情を主人公にぶつけてくる。
もしそれが「いつも通り」であれば、俺も「そうなんだね」としか思わなかっただろう。
しかしその人物は号泣しながら鼻水を垂らした。
涙だけでなく鼻水を垂らしたのだ。
さらにあろうことかその鼻水をズズーッと引き上げ鼻の中に戻した。
そしてそのまま彼は力強くこちらに語りかけ続けた。

俺はそのシーンを目の当たりにしたとき、とんでもない感動に襲われた。
彼はゲームの中で呼吸している！と。
呼吸なくして言葉はだせず、言葉なくして感情は吐きだせない。
現実の摂理をしっかり描写することで、彼の「表情」に真実味が帯びたのだ。

そのとき、俺は彼を一人の人間としてみた。
思想や行為に共感するしないではなく、そこに生きた人間がいると思えたのだ。

Far Cry 5は難しいゲームだと思う。
使いまわし、焼き直し、意味不明なストーリー、その他諸々。
否定されて然るべき点はいくつもある。
だが沢山の人間が関わった大作だからこそ、
簡単には見えづらいところに輝く要素が転がっているとも思う。

俺にとってそれはYESの看板裏だったり、チーズバーガーのモーションだったりするわけだが、一番は「鼻水」だったのだ。

すべてを探す気でいるなら、Far Cry 5はいまだ驚きを与えてくれるゲームだと思う。",,,,,,0
308,308,76561198186659565,3484,False,21,"過去作より劣化したディティール、モーション。FarCryの胸糞ストーリーはいつものだが、4とかはちゃんと納得できるし買ってよかったと思わせる内容だったが今回のは胸糞をはき違えてただたんにムカツクだけのストーリーになっている。サブミッションやオープンワールドの雰囲気は良し。メインストーリーはあまりにもテンポが悪い。
買うならセールまで待っても問題ない作品。",,,,,,0
309,309,76561198033983858,2225,False,4,何も変わらないfarcry変態が変態なこと言ってわけわからんことをやってるクリアしたけどもう二度とやらないかな,,,,,,0
310,310,76561198085349462,1254,False,7,エンディングが・・・,,,,,,0
311,311,76561198114162563,681,False,3,"進行不可能バグがあり、全く進められないし。オートセーブ機能のせいで最初からやらない限り進めないし。
最初からしても同じバグで進められない。",,,,,,0
