,number,steam_id,playtime_at_review,voted_up,votes_up,review,story,graphic,character,music,Operability,story_state
232,232,76561198079772364,2517,False,35,"年末にまとめてプレイしたくてキープしてエンディング見たので書き直します
結論を先に言わしてももらうと「NEGATIVE」で評価します。

理由としては
ゲームそのものは楽しめたものの
・カーラジオでしかストーリを流せない演出は問題
・強制拉致はオープンワールドというジャンルにミスマッチ
・ミニマップとクラフトはほしい
・字幕の文章の切り方がおかしい

以後、一つ一つ詳細に説明します。

まずはまだED見てない人は「Far Cry:New Dawnの情報を見ないでください！」
far cry史上初のストーリの繋がりがあります！
UBIはあんまりそれを気にしていないのかネタバレ的な要素もtrailerに入れていますが、
ストーリを気にしている方はNew Dawnの情報を見ない方がいいですね。

で、このゲームのストーリですが、演出にかなり問題があります。
私も後からわかったんですが、実は世界観やストーリに関わる大事な情報は「車のCar Radio」に流れています。
どんな内容かはネタバレになるので詳細は書きませんが、
ラジオを全部聞いてから見ると最後の抵抗EDも納得が行く演出らしいです
ただ、私はファーストトラベルの開放までは歩くか、車で移動して、
その後はperkを開放して「エアドロップ」でファーストトラベルメインで進めていたので
「車ラジオなんか聞く機会がほぼない」ですね。
そういうプレイヤーへの配慮がないというか、ちゃんとストーリが分る演出にしていないので、
正直にEDみた時は「はあ？」と思ってました
なんか別の要素、たとえばNPCとの会話とかに一切入れてないので、カーラジオのみは問題だと思います

次に何回も繰り返される拉致イベント
教団の力を大きさを示すための演出かもしれないですが、これは映画ではなく、ゲームです！
プレイヤーにとってはただの強制イベントの繰り返し。
１回目はまあいいとして、３人が全部同じパターン。
「いまほかのクエストやってたのに、強制イベントでキャンセルされた！」
特にこのゲームはオープンワールドです。
ストーリ進むか、サブクエスト進むかなどを自由にプレイヤーが決めることができないシナリオ設計は
オープンワールドではなく、リニアゲームですね。設計から問題ありと感じます

この２点はかなり大きく、ほぼこれでゲームの評価が決まりました

UIからミニマップの削除もかなりマイナスですね。
開発チームにはなにかの理由はあるとは思いますが、ただ不便になっただけですね。
特に地下に移動する必要がある＋夜にきた場合は混乱しかないです
マーカーは表示されているのになにもない！状況が連続する
ミニマップがあればなんとかなったかもしれないですが、、、
結局マップ見てしまうので、メニューを開く回数が増えるだけの不便が増えるだけです
消すよりはオプションを入れてデフォルトはオフとかにしてほしいですね

あと、細かいところの指摘もあります。
まずクラフティングが削除されていること
4やprimalまでは狩りをして装備を作る楽しみがあったけど、
今作では装備クラフトがない（消耗品のクラフトはありますが）
狩りそのものの意味があんまりなくなってます。
チャレンジの数だけ足りれば狩りやる意味もなくなります

あと、私はある程度英語も聞けるので英語音声＋日本語字幕でプレイしていましたが、
字幕の切り方がおかしすぎて、文章が終わってないところで切ったりしてむしろ邪魔です。
翻訳というより、字幕そのものがダメです
上記のラジオ関係もあるので、ストーリを知りたい人は「日本語音声」でプレイをお勧めします。
カーラジオもちゃんと日本語だし。

最近話題になっている政治的な正しさからの指摘もありますが、
やだらと黒人は多いものの、ネイティブアメリカンがない！！
日系アメリカ人もあるのに、ネイティブアメリカンがないのは人口構成大丈夫か？
と思ってました

結局
ゲームそのものは楽しめる要素は確かにあります。
でもストーリと演出の問題が大きくて、最終的にはNEGATIVEにします。
特に強制イベントはストーリや演出を気にしない人にも不評になるだけの印象です。
primalまではよかったので期待してましたが、残念です。

New Dawnで挽回してください。",,,,,,1
233,233,76561198135438548,1162,True,2,"ストーリーは賛否両論だけどゲームとしてはとっても楽しい
ハイクオリティなグラフィックで作られたアメリカの大自然でシカやクマや乱入してきたカルト狂信者を狩るのも一興
君もM６０を担いでかわいそうな獲物たちに２１世紀のハンティングを思い知らせよう",,,,,,1
234,234,76561198836257034,2643,True,24,"イカれたカルト連中をやっつけるドンパチゲーム。
ストーリーに関しては褒めるところはないです。物語的にもゲームとしても続編が出るようなのでそちらに期待したいです。
ゲームとしてはカルト相手にドンパチしたりゆったり釣りをしたりとかなり楽しめるゲームなのですがミッションに不満が少し
新鮮味のない同じようなミッションの繰り返しのように感じてしまい人によっては飽きるかもしれないな〜と思いましたが、マルチでプレイしたところ飽きなど感じさせずに楽しめました。マルチでワイワイやりながら遊ぶなら楽しいゲームですのでセールの時にでもフレンドと一緒に買うのはどうでしょう。",,,,,,0
235,235,76561198272475488,2926,False,0,"正直言っておすすめできません。
メインシナリオに関する重大なバグが存在し
それをそのまま放置している現状が一点であること

フェイス・シード戦でメインシナリオの進行が不能になる
重大であまりにもひどいバグがあります。

一部の航空ユニットの偵察時に
極度にラグが発生する場合があります。
スペックが推奨以下の方でなくても
確実にクラッシュを起こします。
（※そのための緊急処置オートセーブのように感じました）

はっきり言って此処まで僕を不愉快にさせたゲームはありません。
完成度は、表面上高くとても面白いのですが
こういった重大なバグを意図的に見逃しているのか
それとも気づいていないだけなのかわかりませんが
広大なマップで数々のミッションを用意することで

長く遊んでもらう企画だったのでしょうが
はっきり言って重大なバグを見逃すほどならやめたほうがいいです。

この重大なバグを多数残したゲームやるぐらいなら
ゴーストリコンをおすすめします。
あちらのほうがバグは少ないです。

はっきり言ってフェイス・シードに関する
メインシナリオ進行不能バグに陥ると
データを消す以外の脱出は現状不可能です。

はっきり言って最初は高画質、自由度が高い
面白いかもしれないと我慢を重ねてきましたが
進行不能バグによる不快感と絶望に耐えきる自身がなく

低評価とさせていただきました。

このゲームに時間を費やすよりも
他のゲームに費やすべき、という判断に至りました。",,,,,,-1
236,236,76561198836843876,379,True,1,"Лучшая игра за час можно погрузиться в геймплей по уши
Игра так и тянет тайнами
Лучший сюжет серии
",,,,,,0
237,237,76561198334289474,685,False,0,マップが広くて飽きてくる,,,,,,0
238,238,76561198017388531,2838,False,8,"3からすべてやっています(プライマル含む)。
テンポが絶望的に悪い。
フリーで好きにやっていると、勝手に捕まって、また逃げて……(まぁ過去作からありますけど)
で、3回目にはさすがにゲーム止めました。
ねーちゃんときゃっきゃうふふの夢の世界も訳分からんし。

とりあえず、アメリカでやるFarCryって感じで目新しさは全くないので、
お勧めはできません。
",,,,,,0
239,239,76561198125218009,2870,True,0,新人保安官になってカルト教団を戦うゲーム　DLCはセッションパスもちゃんといれて買ってね！！！！単品DLCだけじゃ遊べないよ！気を付けて！！！許さねえ！！！,,,,,,0
240,240,76561198273123954,3496,True,3,鉄塔登りを無くしたのは好評価,,,,,,0
241,241,76561198155853988,3271,True,2,"２０１８年最高のゲーム

悪かった点
・強制ミッション。みなさん言っている通り。特に東側はボスも強制です。
・収集物が、かなり近づかないとどこにあるか分からない。

良かった点（過去作と比較して）
・北のヨセミテ、西の北海道の様な雰囲気が過去最高に良い。トレッキングやドライブ好きな人はぜひ。
・無意味な宝、電波塔昇り、めんどくさい狩りの廃止。
・動物弱体化。
・全体ＭＡＰが３Ｄ化、簡素だがミニチュアを見ているよう。
・特定の場所で好きな乗り物を呼び出せる。
・仲間との共闘、犬、猫？、熊を連れて行くことも可能。もちろんソロ可。
・空中からダイブできる。移動が楽しく簡単に。
・3方向好きな順に攻略できる。


総評
評価低かったがファークライ３、４が好きなので購入。強制ミッションも事前にしっていたので気持ちが楽。
もう３や４は出来ないと思えるほど。
ストーリーも洋画のようで良かった。フェィスがかわいいし（笑）。
やった事ない人は５のシーズンパス買って無料でついてくる３をやってからがおすすめ。",,,,,,1
242,242,76561198133152010,674,False,4,"3のほうが面白かった。
5は作業ゲーの要素が強く、ストーリーも説明不足で意味不明。
地味に野生動物がとにかくウザくてやる気がだんだん無くなっていく・・・

あと日本語字幕は適当に流しているだけで、音声とズレまくっているという手抜き具合も大分ガッカリさせられました。",,,,,,-1
243,243,76561198039636889,2215,True,15,"【良いところ】
・いつも通りのFarCry
・農村、銃、マッスルカー、貧乏白人、アーケードゲーム、プレッパーたちなど、80年代アメリカ南部の雰囲気を楽しめる
・釣りができるようになった
・コンパニオンの組み合わせによって会話の内容が変わる
・ストーリーの内容がかなりブラック
・風刺と皮肉が盛りだくさん
・スーパーアメリカン

【悪いところ】
・シリーズ恒例である動物の毛皮からアイテムをクラフトすることがなくなった。そのせいで狩りの楽しさ半減。
・釣りできる魚の種類が少ない。釣り道具もかなり適当。
・銃カスタムの自由度が低い。ピストルと対物ライフルのサプレッサーの形が同じなのはどうかと・・・。
・メインストーリーの進行が強制的
・犬を車に乗せてあげることができない

【評価】
銃のカスタムや釣りなど諸々、細部の作り込みの甘さが気になる。オープンワールドのFPSゲーとしては十分におもしろいが、ストーリーの内容からすると万人受けはしなさそう。FarCryシリーズが大好きな人やアメリカ文化に興味がある人にはオススメできる。過去作やったことない人は素直に3から始めましょう（個人的には2もオススメです）",,,,,,1
244,244,76561198059260488,1743,True,9,"（筆者は２から５までプレイ済みです。）
アクション性やゲーム性はほぼ今まで通りのファークライです。
前作と比べて剥ぎ取りモーションが省略されたり、女性の敵が多く出てきたりした所と、グロが緩和されていた所が印象的でした。
あと前作よりテイクダウン後のコンボがやり辛く、爽快感がダウンしていたところが残念です。そして難易度も下がっています（重装兵士相手でもスキルなしで正面からテイクダウンできちゃう＆ＬＭＧでゴリ押しすれば大抵クリアできます）。
アシストも有能すぎます笑

今作は動物のモーションがリアルでかわいいですね。
序盤は見かけるとすぐ襲ってくるので見かけたらマシンガンで撃ちまくっていましたが、
弓使いの女子と一緒にいると、動物が襲ってこなくなるので、動物対動物の戦いが見えたり水辺で魚を捕りに行くクマさんを観察できたりします。そこらへんの配慮は二重丸ですね。

あと犬がボール（部品）を持っていっちゃうサブクエで、追いかけっこするのも楽しかったです（半分の人は反射的に撃ち殺しちゃうんだろうなぁと予想）

んで、一番好きなのが釣りシステムですね。
これはハンゲームのわくわくフィッシングをそのまま3Ｄにしたようなシステムで、シンプルかつ魚とのやり取がり楽しくてずっとやってました。魚種も結構豊富で、釣りのためにフィールドを右往左往していました(;´∀｀)
ラインがギチギチなるときの緊張感が溜まらないですね～！

オープンワールドＦＰＳと釣りの相性は抜群で、このシステムでタナとエサの概念を追加してくれたら神（釣り）ゲーだと思いました。

総評としてアクション面はなんとなくファークライ2に回帰した感じですね。
ヘリと飛行機の出番が少なく、近接攻撃が弱体化し、陸路がメインになっていたので。
ただ後半はファストトラベル＆ウィングスーツでかなり楽ができちゃいますが。

アーケードはこれから楽しもうと思います。

ストーリーのレビューは他の方がおっしゃる通りです＾＾；
強制連れ去りイベントもちょっと微妙でした・・・
ただそのあたり目をつむればおススメできます。",,,,,,-1
245,245,76561198366645991,1497,False,36,"単純に物語が面白く無い。
フルプライスでの購入はおすすめ出来ない。

長々と比喩表現だらけのよく分からない話をされてダルい。
幻覚なんだか現実なんだか分からない状態で戦うため
倒したと思った敵が倒せて居なかったりする展開など
所々「は？」と感じさせるストーリーがイライラ感を募らせる。

サイドミッション消化の途中で急に敵に連れ去られるという
快適なプレイを邪魔される機会が多く発生し
「時間が時間だし、あと１ミッションやったら終わろう」
と思っていたら急に連れ去られて長い話が始まる。
(聞いていられないので途中からスキップ連打した)

シューティングやオープンワールドとしての要素は十分面白いのに
ストーリーと演出が全てぶち壊していくので台無し感がすごい。
",,,,,,-1
246,246,76561198086949561,10970,True,2,"Co-oPでしてくださる方、フレンド募集中です！
また、FPS下手な自分でよければCo-oPでお手伝いもします(｀･ω･´)ゞﾋﾞｼｯ!!

Far Cry 5の個人的な感想なのですがゲーム自体のドンパチは面白いです。
でも、ことあるごとに拉致られる主人公と飛行機のスタントマンミッションにはガッカリでした。
あとED…(´･ω･`)",,,,,,0
247,247,76561198004281805,562,False,25,"たとえセールでも不快感が勝るので買うのはオススメしない。
冒頭の惨劇を抜けると無敵に振舞うのは毎度のノリ・・・・・・
と思いきや進行で発生する強制かつ非現実的な理不尽ミッション、
終始鳴り響くカルトの音楽、広大な筈なのに敵との遭遇は多く却って狭さを感じる。
そしてトドメは勘弁してほしい操作し難い飛行機ミッション。
途中でやめるとロードを挟むたびに案内音声が繰り返される。

もういい！　カルトのリズムを大音量で流されるだけでも気が滅入る、
ロード画面では毎回カルトの説教だ。
FarCryは毎度エンディングで「なんなん？」と思ったが、
コレはプレイ時間の大半が「なんなん？」だった。",,,,,,0
248,248,76561198149007849,3155,True,0,call me father,,,,,,0
249,249,76561198406121951,1095,False,2,メインミッション進めなくなるバグがあります。ゲーム自体は楽しめていましたが進めなくなるバグがある時点でおすすめは出来ないです。,,,,,,0
250,250,76561198028905040,1918,True,0,"Far Cryシリーズは今作が初プレイで、一週目クリアしました
Ghost Recon Wildlands(ベータプレイ中に飽きた)と比較するとストーリーに起伏があります
ゲーム中盤には、勧善懲悪ではないことが示唆され、 
映画「セブン」っぽい後味のストーリーとなってます（ストーリー分岐あり）",,,,,,0
251,251,76561198018762135,4900,True,10,"良い点
・ロケーションが孤島でも砂漠でも山岳でも無い、ただの片田舎
・主人公の性別や顔、服装を自由にチョイス
・弾道に物理効果が追加
・魅力的なスペシャリスト達
・心癒してくれる動物達
・[strike]洗脳ソング[/strike]サントラ集が素晴らしい

悪い点
・強制的に始めさせられるメインストーリー
・武器カスタムがショップ画面からのみ
・200m以上の狙撃不可
・字幕のクソデカフォント
・3から相変わらず代わり映え無し

注目点
・いつもの塔登り廃止
・影の薄くなったクラフト要素
・釣りが出来る
・救いのない？エンディング


ナンバリングが5となったFar Cry。
舞台はアメリカ合衆国モンタナ州のホープカウンティと呼ばれるとある田舎。
聞くだけではパッとしないが、実際に遊んで見ると過去作と比べても最高のロケーションだったように思う。
放牧地はもちろんの事、湖からその奥に連なる山々など思わず写真で撮りたくなるような、本当に足を運んでみたくなるような、魅力的な風景や自然が広大なマップ上で至る所で再現されています。
そのおかげか、ファストトラベルは大して利用せずに徒歩でばかり移動していました。
3や4のマップはどこかしら似通った場所が多く、後半に連れて飽々としてきましたが、今作はエンディングまで常に新鮮な気分で遊ぶことが出来ました。

主人公は新米の連邦保安官、過去作とは違って名も声も無く、プレイヤー自身が分身となって、村を実効支配してしまったカルト教団と対峙することになる。
勿論、主人公の外見は好きなようにカスタムが可能、とは言えCoopで遊ばなければ何の意味も無いような要素ではあります。

たとえCoopで一緒に遊ぶフレンドがいなくても、NPCを引き連れる事が出来るので問題無し。
レジスタンスに加わった村人達、スペシャリストと呼ばれる特殊な技能を身につけた6人+3匹と行動を共に出来ます。
プレイヤーを含めて最大3人（匹）での行動が可能。
仲間に加わったNPCに命令も行え、AIも中々悪くない動きをしてくれます。
因みにFar Cry 2にも似たような仕組みがありましたが、瀕死の仲間を助けなければ二度とそのマップ内では会うこと出来なくなってしまう、完全な死がありました。
しかし、今作のNPC達には所謂、不死属性が付いているため、ダウンしてしまっても数分後にはしれっと前線復帰してしまうので2でのような緊張感はありません。

今作からは銃を撃ってもサイトの点に合わせれば即着弾、と言う訳には行かなくなり、ターゲットの動きや弾丸の速度を考慮して狙わなければいけなくなりました。
広大なマップで遊ぶシューターなら当たり前の要素だとは思いますが、歓迎しています。
とはいえ、200~250m以上先からは弾丸が消滅してしまうのは3や4から変わらずのようです。
ゲームエンジンの仕様なのかリソースの都合なのか開発が嫌ってるプレイスタイルなのかどうかは分かりませんが、ぶっとい対物ライフルで長距離狙撃なんてプレイはどうやらやらせては貰えないようです。

基本的な部分は3から全く変っていません。
道路を行けば悪党共が、道を外れれば野生動物達が支配している広大なマップ上でどう生き延びて行くか、これだけです。
4の時点で辟易としてしまった方には5を遊んでも満足できないでしょう。

ゲーム音声は英語音声日本語字幕と日本語吹き替えが両方選べますが、肝心の日本語字幕のフォントが非常に大きく、また途切れ途切れで表示されるので、ストーリーに熱心に耳を傾けたい方は吹き替えの方が吉。

賛否両論あるエンディングですが、2以降、正義と悪との違いとは何か、何の為に戦うのかをプレイヤーに常に問いかけ、ゲームの世界から一気に現実へとプレイヤーを突き落とす事を続けてきたこのシリーズを象徴させるようなエンディングと言ったところでしょうか・・・
それを肯定的に捉えるのか、否定するのか、どう解釈するのかはプレイヤー一人一人の判断だと思います。

[spoiler]ファーザーを崇めよ。[/spoiler]


個人的評価
★★★★☆

★★★★★ 買え！
★★★★☆ おすすめ
★★★☆☆ 面白いけどおすすめはしない
★★☆☆☆ おすすめしない
★☆☆☆☆ うんこ

☆☆☆☆☆ 買うな！",,,,,,-1
