,number,steam_id,playtime_at_review,voted_up,votes_up,review,story,graphic,character,music,Operability,story_state
0,0,76561198061158830,2679,True,0,"例えるなら家のカレー。食って感動もしないが、週一で食えと言われても抗議するほどではない水準は超えてくる味。いつものFarcryであります。僕は私は沼って人生を損なうようなゲームは要らないのだ、武装した阿呆とちょっと戯れられればいいのだ、というような方々には宜しき一品かと存じます。

ちなみに本作では釣りが導入されたが、マウス＋キーボードでは「竿を傾けて維持する」という重要な操作がかなり難しい。これから釣る貴方も、既に「提督」と戦って30分をドブに捨てた貴方も、ゲームパッドをお試しあれ。",,,,,,0
1,1,76561199074698711,28,False,0,たかだかゲームをするのにアカウントを要求してくる時点でストレス,,,,,,0
2,2,76561199166437571,161,False,1,バックできない。まともに操作すらできないくそげー。ほんとうにおすすめしない。くそげーです。二度と買いません。ネット上にある解決方法もすべて無駄でした。私以外に同様の方が多くいるようです。コントローラでのプレイを予定している方は絶対に買わないでください。,,,,,,0
3,3,76561198054040900,2064,True,2,"いつものFar Cry
散歩してると急に強制イベントに巻き込まれるのはマジで面白くないやる気削がれる、イベント結構難しいし

コンパニオン連れていけるのが良かった「おっきい猫ちゃんだね〜（豹）」
セール時ならオススメ本体のみで大丈夫
ズンパスDLCはクリア後購入で問題ないです
ナイフキルが無いのが良くわからない定番なのに",,,,,,0
4,4,76561198159657845,875,True,1,"ゲーム開始して最初の選択で便所に行って帰って来たら、ゲームクリアしてました。
数年たっても前作とまったく同じで、良いゲームです。進化もしない良いゲームです。",,,,,,0
5,5,76561198451298901,2394,True,0,"このゲーム、HDR対応してます。
グラボをRTX3060に買い替えたので、1440pのHDR表示で遊びなおしましたが、自然の景色、オープンワールドが美しくて良いです。

強制イベントがたまに発生するのが、難点ですが、それもこの世界の設定というか、世界観なのだと思って遊ぶしかないと思っています。

あと、よくわからずに難しいエリアに先に入ってしまうと、難易度が高く感じてしまうかも。弱いエリア攻略する前に先に後半レベルの難易度の高いエリアに進むことも出来てしまいます。（自分がそうやっていた）

ヘリコプターが、リアルさを捨てて操作しやすいのは良いです。便利な空中移動手段と割り切れば。

あと、ゲーム本体だけ購入してそれ以外は無課金だと武器や乗り物のアンロックが少し時間がかかる。
課金してね、ということでしょうね。

ファークライ３は面白くてエンディングまでプレイしましたが、４と５はまだ途中まで。悪くはないのだけど、シングルプレイのオープンワールドのゲーム全般に自分自身が少し飽きているのだと思う。ＵＢＩ（ＵＰＬＡＹ）のやつ。セールでだいたい買ってしまうんだけど。ウォッチドッグ２もＨＤＲ対応して欲しいな。
",,,,,,0
6,6,76561199112570463,210,False,1,買って二日目で全く起動できなくなったんだが…まだ3時間くらいしか遊んでないのに…何これ？詐欺か？金返して欲しい。,,,,,,0
7,7,76561198208326904,708,False,3,"Xboxコントローラーでバックができないバグと、ヘリで下降ができないバグと飛行機で減速ができないゲーム。
PlayStationのチェックを外しても再起動してもどうしようもないので、キーマウスで遊ぶしかないです。",,,,,,0
8,8,76561198965575571,472,False,5,"コントローラで車のバックができないと大きく書いといてください。
絶対に買ってません。",,,,,,0
9,9,76561198870598446,2054,True,0,:),,,,,,0
10,10,76561198069319968,9379,True,2,"エリコン２(有線)を使用時に、ヘリの下降ができない(ボタン設定がされない)状態になっていたのですが、回避策が見つかったので共有しておきます。

Steamランチャーのゲームのプロパティを開き、コントローラの設定でSteam入力を無効にした後に、UBIのランチャーからゲームを起動し、コントローラーが効かないことを確認したら、ゲームを起動したままでケーブルを抜いて挿します(コントローラを認識しなおす必要がある？)。
その後下降ボタンが空白になっていたのが正しく設定されなおされるので、そのままプレイ続行です。
ただし、ボタンが正しく設定された状態でプレイしたい時はUBIランチャーでゲームを起動しなければいけないことと、起動ごとにケーブル抜き差ししなくてはいけないので注意。
－
以下はゲームの感想です。

カントリーVSカルト宗教なオープンワールドFPS。面白い。4/5。暴力を(楽しませる的な意味で)主眼とするゲームなのにラスボスにそれはどうなの？ と言われるゲー。ラスボスが選択を非難してくるわりにあまり選択をさせてくれない作品でもある。しかしプレイフィールやBGMは良く。ラスボス戦も熱い。

ネタバレですが、選択(正義感)や強制力(暴力)をもって全てを解決しようとする主人公(保安官)の態度をラスボス(教祖)が説教してきて、その言葉がFPS(暴力ゲー)を楽しむプレイヤーにまで到達する的な感じなのですが、大規模開発(売らないといけない)故に、綺麗にまとめきれなかった感があります。

前述の様に主人公の(地域制圧開放FPSの)主人公故の選択をラスボスは説教してきますが、主人公(プレイヤー)にはそれ以外の”プレイ”での選択が実質ない。ゲーム開始直後にゲームを止めるか、ラスボス戦前に戦うのを止めるかだけ。これでは響かない(プレイヤーの反発を招く)よねと。

更にネタバレですが、結局ラスボスの世界は崩壊するという主張が大体正しく、主人公達が避難準備を邪魔してたオチで終る。これを素直にとればラスボスが正しく主人公が間違っていたととれますが、ラスボス達の(残虐な)所業を顧みれば、主人公達を非難するラスボス達も同じ穴の狢であるとも言え皮肉に溢れた作品でした。

と、コンセプトは面白いが、大作故に詰めきれていない感じでしたが、光る所も随所にあり、音楽、米国の田舎の穏やかな土地の中に溢れるカルト信者との戦い、カルト幹部(中ボス)のキャラ立ち、住民を救う流れ者(主人公)、抵抗組織設立、そして最後の善と悪のゾンビアタックなラスボス戦、等々。

特にラスボス戦には痺れました。今作全てを象徴するとも言える奪い合いのゾンビアタック合戦で、しかも主人公とラスボスの立ち位置の違いまで盛り込まれているという。ゲームをプレイしていて久々に痺れたイベント戦。これだけでも僕は買った(プレイした)甲斐があったと思いました。

ただ、その流れからのエンディングはアレですね。最後まで主人公に選択させないゲームだなと。ゲームなのに選択させないことで選択するという意味を考えさせる後味というか。皆さんゲームは選択であると言うが、言うほどゲーム(キャラ)に選択肢はないよ？ という構造批判でもしているのかも(笑えない)。

ゲームプレイ部分で言うと、個人的には気持ち良く動かせて楽しく、殆ど文句はないのですが、イベント強制進行だけはちょっとなという感じでした。これも気軽に周回できるゲームならともかく、オープンワールドの1ルートの物量が増し増しな大作ゲームであるが故に余計辛さを感じたというのもある気がします(一からのやり直しがつらいのに加えて、広大なマップ探索しているうちにランダムイベントでイベント強制進行条件を満たしてしまうので、嫌なら気をつけてプレイする必要があり、窮屈なプレイになる)。
あ、噛み合っていないといえば、ステルスと仲間の兼ね合いも中々難しい案配な気がします(基本見つかりにくい犬とジェス固定でプレイしていました)。
仲間がいると賑やか(和ん)でいいし、仲間が強すぎると今度は別の問題が発生するので、その辺りは難しい調整だとも思いますが。

最後に。今作はアーケードモードというマップクリエイト・公開モードがあり、本編のビジュアルや音楽の良さ、操作性の良さから、ユーザーが作ったマップをアーケードライクにプレイできるこのモードは楽しく今作の長所の一つだと思います。(ただ前述の今作のテーマを考えると以下略",,,,,,0
11,11,76561198453212129,3484,True,2,"しょうがないじゃない。面白いんだもの
こんなことは正にfar cryであってくれよ、と願う",,,,,,0
12,12,76561198150393015,1696,True,7,"ストーリーで心が折れない精神力が求められるゲーム
そして心が折れない精神力を持っていても最後で心がポッキリ逝く",,,,,,0
13,13,76561199002810044,2482,True,0,good,,,,,,0
14,14,76561198338309475,6927,False,0,item pickup auto save stutter,,,,,,0
15,15,76561199108902715,6134,True,0,良い,,,,,,0
16,16,76561199034574543,4467,False,0,"ストーリー世界観ともに最悪。
１．意志を全く感じない主人公（人形？を動かしてる感覚）
２．終始気持ち悪い思想を聞き続けさせられる
３．ドラッグや暴力やマインドコントロールで支配しながら、なぜか最後は…いったい何のためにプレーさせられたのやら
４．３のような世界観にするならＧＴＡぐらい、ユーモラスなぶっとび感や爽快感にしてくれよ、、、ただただ暗い
5.last of usみたいに、よいんが残るならよいが一人よがりの価値観を押し付けられた内容
６.何度捕まるねん。。こんなひ弱な主役をなぜか仲間にとりいれようとするその眼力、、、、、なさすぎやろ

ただストーリーや世界観を気にしないかたは、面白いのではと思います。
ファークライのなかで一番、金と時間返せやって言いたくなる内容でした。",,,,,,0
17,17,76561198316085959,1252,False,1,"・薬物使用の推奨
・宗教がらみの事件
・暴力による解決
公序良俗に反したカスゲー",,,,,,0
18,18,76561198856848159,4052,False,0,ロード無いです。評価 ☆１ を決まり,,,,,,0
19,19,76561198301791164,3112,True,1,"最高難易度インファマスクリアしました
今まで買ったゲームの中で一番おもろい
ミッションおわるとあんまやることなくなるけどまた難易度変えてまた最初からやると面白いです",,,,,,0
20,20,76561198089963250,1710,True,0,tintiが爆発するかと思った,,,,,,0
21,21,76561198321985397,2572,False,3,"初めてオープンワールドFPSをやったので新鮮で楽しかったです。
淡々とミッションをこなすのも好きなので自分にあってました。
でも同じことの繰り返しに近いので人を選ぶとは思います。

武器、敵、乗り物の種類は少ないかなと思いました。
戦い方なり移動方法なりバリエーションがないので、作業感は強めです。

ストーリーは（最後まで見てないが）可もなく不可もなしって感じでした。
続きが気になるって感覚とかはなかったのでつまらない寄りかもしれません。

最後に、ネットの情報でも多く回っているかもですがバグが多いです。
ミッションがクリアできない程度ならいいのですが、自分の場合は本来発生すべく強制イベントが発生せず、永遠にストーリーミッションを進められない状況に陥りました。

（愚痴）
セーブスロットが1つのみ+オートセーブなので進行不能バグに気づかずオートセーブが行なわれて詰みました。
また、ミッション中は手動セーブができない仕様で、強制イベントの未発生はストーリーミッション中の扱いになるため手動セーブも書けません。
加えて、フラグがごっちゃになってるのか特定の行動で毎回行われるはずのオートセーブもされないため、どれだけサブミッションを進めてもセーブが書けないという仕打ちでした。
ストーリー以外のサブミッションも片っ端から埋めていく形で進めて、全体の8割は終えたところで発生したので大分萎えました…。",,,,,,1
22,22,76561199095384381,2058,True,7,"GTAシリーズが好きな人だと割と好みなんじゃないだろうか。しかしシナリオ的に爽快感がある展開にはならないので、そのあたりをこういうのもありかと噛み含められる人でないとストーリー展開に対して不快感を覚える可能性がある。

良い点
・ボリュームが多い
・パークを開放しているためもあるだろうけど銃のエイムがかなり早い
・個人的にBF4やGTA5をした後だと航空機の操作はかなり楽な方だと感じた
・オープンワールドならではの探索自由度
・ラスボス以外は適正な難易度（ラスボスはやや難しいと言うかだるいと言うか…）

悪い点
・味方が勝手に戦闘したり見つかったりするのでそれがストレスになる場合がある
・動物がややかたく強い武器でないと数発弾を撃たないと倒せない
・一定の条件（ざっくり言うとカルトに対する攻撃で貯まるポイントによるもの）でイベントで強制的に拉致されるので計画が狂ったりする
・あるイベントで武器が没収される（これは武器屋で揃えられるから一応取り返しはつくけどマネーは消費するのでやめてほしい）",,,,,,0
23,23,76561198947616036,123,False,1,"いわゆるUBIゲーでどの作品プレイしても既視感がすごく即飽きる。最初のチュートリアルで、同じことをコピペのオープンワールドをひたすら歩いて繰り返すのか、うせやろ？という絶望感にさいなまれる。
ワンコインで買えるなら人生の時間つぶしにあり？",,,,,,0
24,24,76561198827125692,4985,True,0,"5から始めたが、面白いし
日本語化もされてるしのでゲームのジャンルさえ、
好きなら楽しめる！！！！！！！！！！！！！！！！",,,,,,0
25,25,76561198030546492,3287,False,1,"同じ作業の繰り返し。
武器の種類少ない、自由度がない、つまらない。",,,,,,0
26,26,76561198377763841,1976,False,5,"最初は面白いけど、３つカルトに制圧された地区があって一つ目を開放して二つ目をやろうとするとほとんど同じことの繰り返しでつまらなくなる。
銃が最強なので課金で50口径のスナイパー買って動物狩りまくって金集めてカルトボコボコにするだけのゲーム",,,,,,0
27,27,76561198146586099,2574,False,2,"在り来たりなオープンワールドゲーに薄っぺらいストーリーモドキが乗っかってるだけのゲーム

端的にまとめるとこんな感じだった

ストーリーを評価するにおいて結局のところ良し悪しってただの好みだと思うんだけど、このゲームだけは違った
何の導線も似匂わせも伏線もなく、新事実がラストに発覚して謎が謎のままに終わると言った感じ
探偵小説で例えるなら苦労して辿り着いた真実が実はまやかしで謎の新事実がラストで発覚、謎が謎のままに終了。なお伏線など一切無し
と言った感じ
「は？」って言う感想以外の何も浮かばないストーリーと言うのは人生においてはじめてで貴重な体験だった。体験したくない体験でもあった。

ストーリー以外のゲーム部分においては良くも悪くも普通のオープンワールドゲーと言う感じだった
細かい不満点も結構あったはずなんだけど、突拍子もないラストに呆気を取られて全部吹っ飛んだ。",,,,,,0
28,28,76561198427268706,6483,False,2,"ネタバレあり


ファークライという作品に飽き飽きしている状態で発売から数年立って評判が悪いことも知っていたが安かったという理由だけでプレイしたが、これはオススメしたくない
まずキャラクターストーリーに魅力がない、3つの地区を開放する中で、強制的に拐われて全く面白くないミニゲーム・つまらない話・半裸のおっさんの顔のドアップを見ることになり苦痛でしかない、主人公も喋らないから言われるがままなんのリアクションもしないし。

あと動物が強くないクマやクーガーが主な敵対生物だが弱すぎる、過去作にいた水辺に不用意に近づくとワニが襲ってくる何てこともないから恐怖感がないしクラフト要素もないから皮を集める必要もない

主人公も拐われるが味方もすぐ拐われる、3つの地区で同じように拐われて同じようなリアクション助ける甲斐がない
唯一ジョン・シードの地区が一番マシだった味方の死亡もなしでドックファイトが新鮮だった。

最後にここまでクソな展開が続いたので予想通りラストもクソというか、最後の戦いは笑えた、みんな集められてバタバタ死んでは復活してのグチャグチャで蘇生のたびに武器が入れ替わるしでもう何だこれだわ笑

もう6が出ようがピクリとも興味が示さなくなった、最後にジョセフ・シードの声優のてらそままさきさんが昔あら好きなのだが、ジョセフの語りがつまらなさ過ぎて嫌いになりかけたよ、どうしてくれるの？",,,,,,-1
29,29,76561198971225554,3787,True,0,"気軽。
いい意味でいろんなことがざっくりしています。

オープンワールドで自由度が高いのは高いのですが、ある程度地区で活躍すると強制的に拉致されストーリーに巻き込まれます。
また敵が空からかなりの頻度で巡回するようになるので結局、地区解放→観光を繰り返すことになると思います。
一部（主に釣り）コントローラーでのプレイを想定して作られているようです。メインのストーリー進めるうえでは問題なかったです。（蹴りモーションも調べた限りコントローラーのみでしか出せないようです）

戦闘面はサプレッサーつけた銃で敵陣に潜入したり、味方NPCに指示出して指揮官ごっこしたり爆発物大量に持ち込んでったりと色々出来て楽しかったです。
飛行機を操縦したりウィングスーツで滑空したり、大物狙いで釣り興じたり点在する宝探しなんかも楽しかったです。
",,,,,,0
30,30,76561198867405812,1727,True,1,"初めてfar cryをプレイしました。
クリアまでにかかった時間は25時間ほど、サイドミッションを無視し続ければ、もっと早く終わるかもしれません。
難易度はeasyでプレイしましたが、最初のうちは敵が強かったり、自分が弱かったりしたので難しかったです。
ただ、Perkの獲得を進めたり、より強い武器を装備していくことで難易度は適正なものになりました。
銃を撃ちまくったり、いろんなものを吹き飛ばしたりできるので楽しかったです。また、一度購入した乗り物は何度でも使えるのが良かったです。
課金要素もありますが、課金するかわりにゲーム内通貨をためることで課金アイテムは買えるのでその点もよかったです。

よくないところは、強制的にカルト集団に拉致されるイベントが複数あり、思うような自由度は感じられない場合があるというところです。また、狙撃銃のスコープが全然拡大できないので、肩透かしをくらいました。
あと、NPCに話しているときに銃撃戦が起きると、会話が中断されるのはだるかったです。

また、次回作のnew dawnのストアページを見てしまうと、このゲームの結末がわかってしまうので見ないほうがいいです。",,,,,,1
31,31,76561198293316626,1642,False,2,"広大なオープンワールドで好きなように暴れられるのは爽快感があります。
グラフィックもきれいですし、狩猟や魚釣りなど自然と親しむ要素が多く感じれました。

ただ個人的に気になったところが3点ほどあり、第一が武器のレパートリーの少なさとカスタマイズの要素の薄さです。第二はステルスでの攻略もできるのですがテイクダウン以外でのステルスの難度が高いことです、弓などで遠距離から敵を倒した場合にその死体を目撃されると高い確率で現在位置に敵が寄ってきます。複数のステルスゲーを遊んでいるとこの点は気になるかもしれません。第三はストーリー進行の節目になるとオープンワールド上から回想のような状態になり強制的にストーリーモードになる点です。

ネガティブな内容ばかり書いていますがセールで購入したこともあり、楽しめました。
ただしフルプライスで購入していた場合は満足していなかったかなという内容でした。",,,,,,0
32,32,76561198056421466,3229,True,0,"オープンワールドでゲーム性がマップにあって空飛べてってゲーム他にあんまないよね
ストーリーがどうのとよく言われてるけど別にそれはどうでもいいかなー",,,,,,1
33,33,76561199032142487,1296,False,1,エンディングが消化不良。,,,,,,0
34,34,76561199063192699,573,True,0,普通に面白い,,,,,,0
35,35,76561198067344514,2921,True,0,"良かった点はブーマーが可愛かった事と、AKのリロードがカッコいい事。以上です。

剥ぎ取りシステムが大きく変わって狩りをする楽しみはほぼ無いです。
それにガバガバなAIや、小さなバグからミッション進行不可になるバグ等色々とあり、
笑ってしまうようなものばかりでしたがまぁUBIですし…それを踏まえればラスト直前まではなかなか楽しめました。

  ‘‘ラスト‘‘までは、ですが。


FarCryシリーズが好きで買おうか迷ってるって方はセール来てからでいいと思います。",,,,,,0
