,number,steam_id,playtime_at_review,voted_up,votes_up,review,story,graphic,character,music,Operability,story_state
121,121,76561198302515113,1316,True,3,"ゲームは自分的に面白く、グラフィックもよくて軽いという素晴らしいの一言です。ただ数時間プレイしただけでバグや作りこみ、製作陣の妥協点に関する不満が多少見つかりました。

まずガバガバ当たり判定。オブジェクトに刺さったナイフやスコップが割と浮きます。
次に死体。反発係数が高いのか、車に触れるとめり込んで車がぐるぐる回ってどっかに飛んでいきます。（もっと古いゲームで見たことあんぞ）
他にもCOOPで蘇生されると操作不能なったり、このバグ中にテレポート(COOPでホストから200m離れるとワープさせられる)すると画面真っ暗で銃のクロスヘアだけ見えて、メニューが開けなくなったり(セーブできなかった)

（これは素人でも負荷軽減で仕方なかったからってのはわかるけど、200m離れたらワープする仕様が一番つらい。連携らしい連携ができないのでCoop要素が薄れる…）

これまで不満書きましたが、実際ゲームの内容がこれを補って余りあるほど楽しいのでおすすめです。フルプライスの価値あるかっていうと微妙…ですけど。
良くも悪くも4の特徴を継いでるファークライって感じでした。",,,,,,0
122,122,76561198842004353,1587,False,3,"パッドだと乗り物がクソ

ps４とホリのGCパッドだと車のブレーキバック、航空機の下降ができないとんでもクソ使用
発売から2年もたってるのに直さないとか運営バカじゃねえの、パッド完全否定（の割にエイムアシスト付きという）

ストーリーもプレイヤーをおちょくってる内容だし二度とこのシリーズは買わん

",,,,,,-1
123,123,76561198260605734,1270,True,0,"セールで1200円切ったので購入してクリアしました。
他の方のレビューにある強制拉致を承知の上でしたので
気になりませんでした。

オープンワールドはサブクエやりだすとクリア前に
飽きてしまう性分なのでメインクエを中心にプレイ
しましたが、ボリューム的にも自分にはこれで十分。

farcryシリーズは初プレイでしたがMAPはかなり広いものの
簡単に車やヘリが手に入るのでそこまで移動は苦ではないです。

ただ、武器を買うお金が全然たまらずほとんどアンロック
出来なかったのが微妙に感じました。

ただまぁセール価格なのでグラフィックも全体的な操作性も良好
なので評判で迷ってる人は全然アリだとお勧めできます。

70点くらいの満足度でしたがこの会社はそういうゲームが多いので
十分良作の範囲に収まっていると思います。
（セール1200円未満の感想）",,,,,,0
124,124,76561198129697731,2696,True,0,"面白いゲームです
セールで買いましょう",,,,,,0
125,125,76561198239096864,3086,False,2,"操作性とかバトル要素とか諸々置いといて
敵の言うことに惑わされず頭を横に振り続け、最後の最後までシナリオをやり抜いて思うのが、
なんでこの最後なのかと疑問に思わざるを得ない。
もしくは別シナリオでもあるのなら話は分かるが、たどり着いた先が釈然としなさすぎる物語でしたー！ってことで台無しになってる感否めない。
んで置いといたバトル要素とか操作性ですが、空での操作以外は非常にやりやすかったです。
単純にグラもいいってのもあるけど、UIもわかりやすい方だしいいと思います。敵キャラクターが素手ごろで何度も何度も殴りつけてくるようなシナリオに全然耐えれるよーって人なら面白いゲームだと思います。
あ！あとジェスちゃんはかわいいと思います(ワラ",,,,,,0
126,126,76561198290924331,2707,False,4,乗り物の操作性（特に航空機）がひどいものです,,,,,,0
127,127,76561198169169155,1876,False,10,"面白くないわけではないが、不快になる点が多すぎるためおすすめしない
・UBIによる毎度おなじみのバグ多数(進行不能や謎死)
・独特の揺れや演出のせいで酔うことが多い(FPS好きな自分ですら最初の1時間で頭が痛くなった)
・ストーリーを進めると起きる強制イベントの量(ヘリで上空飛行してる自分に矢を当てた上に生け捕りってどうやるの？)
・散策やお宝探し、単純に銃撃戦してるほうが楽しいと感じるくらいのストーリー(それに特化したもっと面白いゲームいっぱいあるよね)
・FPSやアクションなのに爽快感のない操作性(不安定な登る動作　パラシュートなどすぐ使用したいものが長押し　ジャムってるのかリロードするまで射撃できなくなる銃　高倍率と等倍の感度がADS感度として統一されている設定　SGのクロスヘアは個人的に四角にしてほしい)
・ミッション中の演出がしつこく長い(シェルターのドアを開ける動作が長い上にいっぱいあったり無意味にゆっくり長々歩かせたり色々)
・不完全で稚拙な協力モード(これが一番ひどい　これ目的の人は下記の詳細を見てほしい)

協力モードについてはないほうが良かったと思う位ひどい
・協力モードは2人でしかできない　まあこれは別にいい
・ピンが一応あるがわざわざマップを開くか双眼鏡使用時しか指せない上に目当ての場所に指しにくい　しかもピンの色がホストと参加側で別になってるのでお互いが別の場所に向かってしまったりする　
・ストーリーの進捗や実績などはホスト側のみ進行する　参加した側もやってないミッションをクリアしたところでもう一度やり直さなければならない　なので一緒にストーリーを進めることができずホストのお手伝いしかできない
・マップ上でお互いの距離が一定以上離れるとホスト側に強制移動　ミッション中だと即死即失敗　これがやばい
とあるミッションにて、車に乗り逃げる場面でホスト側の車には全座席NPCが乗っていて参加側はその後ろでバギーに乗せられている(降りれない)　時間制限付きで逃げるのにバギーの馬力だと車には追い付けない　離れすぎると即死　じゃあどうするか？　緊迫した状況でバギーの速度に合わせてトロトロ運転するしかない　しかもそうすると制限時間に間に合わない　結局一人でやる　というような場面が何度かある

自分は基本的に協力モードでプレイしていたのでイライラする場面があまりに多くそれなら協力できなければよかったと思ってしまった

総括
オープンワールドを自由に楽しもうと思ってるのにゲーム上の都合や仕様で理不尽に邪魔してくることが多すぎてオープンワールドなのに窮屈と感じた",,,,,,-1
128,128,76561198002436865,1913,False,1,"このゲームは、ストーリーCOOPはありますが進捗が保存されるのはホストプレイヤーのみです。
ゲストプレイヤーは進捗が保存されないので、個別に進捗を進めなければ、COOP時は常に初期装備のままとなります。

以下に該当する方がセール価格で購入するなら、そこそこのゲームです。
・SOLOとCOOPを両方やる気力と時間がある方
・装備にこだわらず友達と一緒に遊べれば満足な方
・ストーリーの内容を気にしない",,,,,,1
129,129,76561198846849667,1819,False,0,"２度クリアしたのでレビューします。
良い所
FPS苦手な自分でも中盤までは楽しめるオープンワールド。操作マニュアルが親切でわかりやすい。
(FPSなのでほとんど自分の姿見れないのに)コスチュームが豊富、武器もカスタマイズできたり、乗り物(ヘリ、ボート、車等)、釣り具も購入でき操作可能。ファストトラベルも可。犬がいる。サイドミッション開放のNPCの声優が豪華。キャラクリが可能(skyrimほど細かくはできない)

悪い所
・民間人３人殺すと自分も突然死する
・雑魚敵の種類が少ないので、同じように見える。弾を漁るとき武器を拾ってしまう仕様。
・花はボタン長押し取得にして欲しくなかった。
・サイドミッションの進行バグが多い(mod導入やtext書き換えで進行可能)
・ストーリー最後の選択肢内容がどちら選んでもクソ

途中までGoodボタン押してたんですが、セール以外で買うとなると他人にはオススメできません。

※i9-9900k,RTX2080Ti,メモリ32GB積んでても３時間進めてムービーが入ると何故か頻繁にクラッシュするのでこまめにセーブ推奨。調べると他にもなってる方が多い。",,,,,,-1
130,130,76561197991788413,576,False,7,"自分のペースでプレイできないゲーム

オープンワールドFPSであるので、基本どこへ行ってもいいし、何をやってもいい。
しかしゲームを進めると定期的に敵に拉致され意味のわからないムービーが長々と続く。
次はこのミッションをやるかーと思っていても強制的に拉致→ムービー→つまんないミニゲーム、とまるでこのゲームをプレイしていることが罪かのような辛い罰が待っている。
ムービーで語られるストーリーもそもそも頭のイカれたカルト信者の語りが延々と長くてとても聞いていられない。
よって私は可能な限りムービーはスキップした。その結果、ストーリーの把握は不可能になり、この世界への興味は消え失せてしまった。もうどうでもいい。

時間を無駄にしたと感じている。",,,,,,0
131,131,76561198995028199,343,True,0,в,,,,,,0
132,132,76561198129129864,480,True,0,,,,,,,0
133,133,76561198812608529,1874,True,2,"ストーリーミッションで『ステーキが台無し』は楽しかったわ　
おじさんがめっちゃ豚に愛着もってて主人公が豚一匹ずつ殺すたびに豚の名前を叫んでるのがシュールすぎてｗブタ一層したら次は敵が牛を連れてきて、、、何このミッション、笑わないほうが無理
　
なぜブタさん達を殺さないとダメなのかはご自分でプレイしてね",,,,,,-1
134,134,76561198064796901,1451,False,11,"ubsoftがクソすぎて絶対に買ってはいけない。
１．ubソフトのツールをインストールしてアカウント登録しなければ出来ない。つまり強制的に２重登録させられる。
２．ubソフトのツールを使っても結局ゲームが所有権問題でゲームが起動できずカスタマセンターに追い合わせしろと出るが、PC初心者にはマジで不向き。
３．メールでしかカスタマーセンターに問い合わせ出来ない上に、返事がなかなか来ない。
４．プレイできてもバグが多すぎてまともにゲーム出来ない。

セール中だろうと何だろうとubsoftのゲームは絶対購入するな。まじでくそすぎる",,,,,,0
135,135,76561198201398582,3719,False,5,脚本の宗教観の押し付けとオナニーぶりに辟易する,,,,,,0
136,136,76561198057201255,1349,False,9,"セールで購入して楽しく遊んでいたのに･･･購入してから3日後にライセンスが消えて起動しなくなった(´･ω･`)
問い合わせしたけど反応は良くない。1200円で2日間遊べるゲームです。",,,,,,0
137,137,76561198163082633,1500,True,1,,,,,,,0
138,138,76561198051532867,3451,True,9,"クリアまでに殺し続けて 1600 人。
街の人も、カルト教団の信徒も、そして自分の頭もきっとおかしい。
カルト教団側にとても愛されている主人公だったので、最後は教団側に付く選択肢が現われるのでは無いかと考えていたが、こんな週末を迎えるとは…
人は選ぶと思うがシニカルで笑える箇所も多く面白い作品だった。
ただ、たぶんちょっと意識が高めの人には向かないのではないかと思う。
全体的には昔のアメリカのゲームのテイストがよく残ってる感じがして、色々配慮が必要な今日この頃、このままでいて欲しいと思った。
暴力の意味だって？1600 人の死体の前で？",,,,,,0
139,139,76561198906095771,249,True,0,q jogo gostoso!,,,,,,0
140,140,76561197971559493,2370,True,18,"発売から２年以上経ってレビューするのもどうかとは思ったのだけれど。
悪評を聞いてずっと避けいたものの、セールで思い切って購入しみたところ、聞いたほど酷くはなかったので書きます。

カルトどもを殺したりしているとポイントが溜まって、強制的に誘拐されて物語が進むのは、イラつく要素かもしれませんが。考えてみると、主人公（プレイヤー）の罪として「憤怒」をつけられているので、プレイヤーがイラつく（怒る）要素は、開発がわざとやっているのかもしれません。
憤怒と傲慢はストーリーで重要な意味を持ちますからね。

今回一番狂っているのは、ゲームの舞台であるホープカウンティの外で起きていること。
ゲーム中の随所でラジオニュースを聞けるので、よく聞いておきましょう。世界情勢に疎いと置いてけぼりになります。
世界がイカレてしまったのなら、まともでいる事こそが狂気なのかもしれない。

さてゲームシステムですが。
これまでのシリーズにあった、マップ解放の為に高い塔に登らされることはありません。
最初だけ登らされるんですが、その時にNPCに言われた「考えていることはわかるぞ。答えはNOだ」には笑いました。
戦闘に関してはいつものFarCryですが、ヘリやプロペラ機で地上攻撃をできるようになったのは楽しい。
ステルスなんぞ捨てて航空攻撃で敵を蹴散らすのは楽しいです。
後述する仲間と一緒に航空攻撃をし、カルトどもを石器時代に戻してやりましょう。

相棒を最高で2人まで連れて歩くことができ。
随所で「ここでヤッたような覚えがあるわ。昼間ってこんななのね」とか地元民ならではの意見が聞けて、2人連れていると掛け合いもあるのが面白い。

今回もハークさん登場！！　でも猿はなし
いくつかの紛争地帯（3と4のことだと思われる）を渡り歩いたことで少しは落ち着いたのか、馬鹿ではあるのだけれど飛びぬけた馬鹿ではない。
そして彼の父母と従兄弟が出てきます、それ見て分かった馬鹿なのはそういう血筋だ。
思い返せば紀元前の祖先？も愛すべき大馬鹿野郎だった。

以下、エンディングへの感想。
[spoiler] 
狂信的な宗教組織も、カルト打倒の為とはいえ大勢殺す主人公も、終末戦争を起こした政治家どもも、同じ罪によって裁かれましたね。人の迷惑など考えない「傲慢」と、違う考えを持つ者への「憤怒」によって。
でもファーザーが正しかったとは思わない。
預言が本当になるのは、それを誰かが信じ始めた時で、そこに真実は必要ないのだから。
 [/spoiler]",,,,,,0
141,141,76561198402186302,6031,True,1,最高,,,,,,0
142,142,76561198026927014,1179,False,5,"良い点
クエストがとっつきやすく報酬が結構おいしい
前作と違いマルチでクエスト進行可能
グラフィックや銃等のリアリティ強化

不満点
ストーリー面が不満だらけ（前作より大幅に劣化）
[spoiler] 強制捕獲イベントが3回ずつ用意されていてお遊戯会が挟まれてしまう
殺意ある癖にイベントだけでは隣人を愛せみたいなノリで殺しませんって矛盾
主人公の思考回路が間抜けを通り越してる
例：敵に呼び出されているにも関わらず建物入った瞬間正面から銃底で殴られ気絶ｗ
現実にもご都合主義で反映される幻覚、「ハイハイ幻覚でしょどうせ」で全ストーリー片づけられるレベルで幻覚多用しすぎ
前作は原因３つの内１つを選択して取り除くエンドだったけど今回は納得いく話じゃなかった、４以上に操り人形というか人形ですらない感じ
どう考えても有害であるファーザー（ラスボス）が正しいエンドしかない [/spoiler]",,,,,,-1
143,143,76561198041213257,761,True,3,岩倉gamesが贈るノンフィクションFPS,,,,,,0
144,144,76561198013320340,5713,True,2,犬がかわいいです、雰囲気が好きであればぜひ、,,,,,,0
145,145,76561198106667173,1947,False,5,"セールで買ってみた。何も考えずにドンパチできるってのは楽しかった。
自分の場合進行不能になるバグにあたってしまい、サポートに連絡した所バージョンアップすれば直ると言われた。
しかし再インストールしても、常に最新にする設定であってもバージョン1.0.0.0から変わらない。
バージョン確認の場所が間違っているのかもしれないが、どちらにせよ直らないので同じである。
一応３0時間ほどやっており、再度始めるのも繰り返し感の強いゲームなので辛い。
この点もサポートに連絡したのだが調査するとの返事で終わった。",,,,,,0
146,146,76561197990231949,79,True,6,"UPLAYで買いましょう。二重のアクティベーションで不便。
UPLAY側で購入しましょう。UPLAY側で購入しましょう。UPLAY側で購入しましょう。UPLAY側で購入しましょう。UPLAY側で購入しましょう。UPLAY側で購入しましょう。UPLAY側で購入しましょう。UPLAY側で購入しましょう。UPLAY側で購入しましょう。",,,,,,0
147,147,76561198024540397,2780,True,6,"２年くらいかけてクリアしました。
オープンワールドでいろいろ旅できるのは本当に楽しいですが、
散々言われているようですが、このシリーズの狂ってる世界観が
ちょっときつい。
今回のカルトも強制イベント、色覚に訴える異常性など
とにかくゲームを中断したい理由が多かった。

続編にあたるニュードーンも買っているので楽しみ、ではあるが、
リアルであるが故に気持ち悪いシーンが多すぎた。

でも仲間たちの旅は楽しかった。",,,,,,1
148,148,76561198267324555,19692,True,0,farcryシリーズ全てプレイしたけど、私はfarcry2が一番すきだったが、この作品だけ、妙に、いい意味で、臭い演出が、なにげに良い、特にホールズエンドの奪還の後の乾杯の渋いシーン、私わビールを飲みながらプレイする、そして、モニターの中のバーの仲間たちと、グラスを合わせる、至福のひと時である、ニューゲーム＋のインファマスは、バランスがくづれている、強すぎるのだ、インファマスを普通のニューゲームでプレイさせてくれないのだろうか？そこを改善してくれたらfarcry2以上になるはずだ￥。,,,,,,1
149,149,76561198203954173,1708,False,4,"主人公気絶しすぎぃ！！！！
自由度が高いのかただただあっちこっち走り回りクエストをクリアしていくだけのゲームというかなり内容がないゲームに思えました。
ファークライは３，４，５とやってますけど４が一番面白かったのがあってちょっとがっかりでした。",,,,,,0
150,150,76561198311357021,2952,True,4,"セールをやっていたので購入してみました。

まず、ゲームを遊ぶ以前の問題として、ゲームパットが認識しませんでした。
LOGICOOLのゲームパットを使用しているのですが、モードをXからDに変更すると認識しました。
しかし、車のバックや飛行機の下降が出来ません。（車の運転に関してはクラシックモードにすれば何とかなりますが）
直す方法は、steamのコントローラー設定のチェックボタンを全て外すと認識します。
しかしながら、この設定にすると、ABXYというボタンが１～４と表記される為、分かりにくくなるため、飛行機の下降のみキーボードを使いました。

また、バグっぽいのが多いです。
ストーリーの進行途中で先に進めなくなる。NPCに話しかけても反応がない。など
再起動で直りましたが。
また、仕様だと思うのですが、ミッションの途中でゲームオーバーになったのに、なぜかストーリーが進んでいるという現象が何度か発生しました。このメーカーのゲームは全体的にバグが多いと感じます。

肝心のゲーム内容ですが、私には難しいと感じました。
FPSをやったことがなく、要領も良い方ではないので、操作で非常に苦労しました。
一人称視点でミニマップもないため、自分がどこにいるのかが良く分からず、すぐ迷子になります。
敵を検知するとマークが表示されるのですが、この一人称視点のため、どこに敵がいるのか良くわかりません。
気が付くと、目の前の敵から近接攻撃を喰らうことが頻発しました。また、エイムが難しく、最後まで慣れませんでした。
また、乗り物の操縦が結構難しいです。この種のアクションゲームが得意な方、要領が良く、慣れるのが早い人なら、
戦闘を楽しむ事が出来るかも知れませんが、慣れないとストーリーを進めるだけで精一杯になり、楽しむという事が難しくなると思いました。

ストーリーに関しては、皆さんがレビューしている通りです。良くないと感じます。

私は75％オフのセールで購入したので満足はしています。セール時に購入する分にはお得ではないでしょうか。
",,,,,,1
151,151,76561198032797061,411,False,5,"このシリーズで強制演出が許されたのは３だけでした。
今回も強制演出てんこ盛り、私はゲームがしたいのであって、ムービーを見て結果を強制されたいとは思わない。
シナリオは下の下。最悪の部類。
破滅願望があるのか知らないが、公に向けて放つシナリオがこんな人の努力を脅かすような思想であってはいけない。最早規制されるレベルの物。
アクション等、ゲームシステムはだんだんと洗練されてきた。
犬を連れたりできるのはとても嬉しい要素の一つだ。
前回に比べて探索したいなと思わせる要素がしっかりある。
しかし、３のようなワクワクまではいかない。マップがひろけりゃいいってものではない。
やたら熊に襲われたりするのは４から何も学んでいない。そんな要素いらない。
敵がカバーアクションをおこすときにワープしたりもして楽しさが半減。
フルプライス時期に避けて正解だった。これからもし買う人はセールで購入するべき。",,,,,,-1
152,152,76561198013862924,66,False,0,meh!!!,,,,,,0
153,153,76561198205005597,3889,True,2,"あいかわらず高水準のシューティングFPS、フレンドと２Pプレイも可能
ステルスの難易度は低く、気持ちよくテイクダウンを持っていける
マップは広いが飛行機やヘリが充実し、ファストトラベルからの空中移動機能もあって移動の苦痛がほぼ無くなっている
クリアまでのプレイ時間は５０時間程度か
ファークライシリーズは後半はついついだれてしまう",,,,,,0
154,154,76561198288175362,2140,True,0,this game is realy fun to play,,,,,,0
