,number,steam_id,playtime_at_review,voted_up,votes_up,review,story,graphic,character,music,Operability,story_state
0,0,76561198133186451,311,True,0,"ちょっとした暇つぶしになる
定価で買う価値はないと思う
セールを狙おう",,,,,,0
1,1,76561198083359898,18,False,1,"ソウルライクゲーとのレビューを見ますが、私は恥ずかしながらダクソシリーズ他をまだプレイしたことがないので、比較してのレビューはできません。単に感じたことの羅列となります。ネタバレ注意です。

＜良かった点＞
グラフィックはキレイ：鎧の質感や歩行モーションなどは良いと感じました。

＜気になる点＞
説明不足：スタート画面に申し訳程度の装備画面解説はありますが、開始すると全裸で（誇張抜き）謎の空間に放り出されます。近くになんか煙がもくもくしてる場所があり、それがアイテムだと分かるのは近づいたときに「Eで拾う」の表示が出てからでした。

操作感：非常によろしくないです。ほぼすべての行動がスタミナ消費性ですが、攻撃は出の遅い3連撃で、見た目ほどのリーチはないです。よく敵の攻撃に割り込まれます。緊急回避のローリングだけはやたらきびきびしていてスタミナが少しでも残っていると出せるので、移動も兼ねて使うといい感じです。

敵：強いです。フル装備で３～4発くらうと死にます。目も非常によく、初回プレイではスタート地点でまごついていたところをなぶり殺しにされました。ただ、攻撃前に立ち止まるので移動していれば攻撃をかわすことは難しくないです。また、普通に敵同士の攻撃でダメージが行くので、敵から逃げてると何体か同士討ちで死んでます。あと敵モデルが2体くらいしか見分けがつきませんでした。

ゲームプレイ：ソウルシリーズやブラボなどの類似ゲーを調べたところ、敵を倒して経験値を得てステータス強化に勤しむというゲームシステムのようで、このゲームも同じようなシステムを採用しています。ただし、敵が異様に強い（こちらが弱いともいえる）・敵から逃げるのは簡単・ボスがいなくて指定場所に到達するとクリアというバランスのおかげで、強化にさしたる意味はありません。とにかく敵から逃げてゴールにつくだけです。

その他：ギロチン振り子？みたいな仕掛けが平然と壁にめり込むのはフフッてなりました。あとステージ4で壁抜けできました。

＜総評＞
操作性が悪く、敵と戦うのが苦痛でした。ソウルライクゲーは上手く敵を倒せたときに脳汁が出ると聞きますが、どれだけ頑張ってもその域に到達できません。そう遠くなく、逃げるのが最適解と気づきます。でも敵の自滅とか、雑なエフェクトとかに時折フフッて笑えるので、90%OFFの62円であれば有益なクソゲーエクスペリエンスが楽しめるのではないでしょうか。

ほぼ不評ゲーに飛び込んだのは初めてでしたが、有益な体験だったと思います。他人にはお勧めしません。",,,,,,0
2,2,76561198215930580,35,True,3,ダクソ風に作られたゲーム。なのだが武器はほぼ二種類しかなくモーションも一緒、そもそ敵を倒さずともクリア可能、敵同士FFするので適当に集めておけばガンガン自滅するなどお笑い要素満載なゲームになっている。クソゲーマニアなら買ってみてはいかがでしょうか,,,,,,0
